journal_no,journal_name,journal_accreditation,journal_url
2215,I-ECONOMICS: A Research Journal on Islamic Economics,S4,http://jurnal.radenfatah.ac.id/index.php/ieconomics
2216,Acta Comitas : Jurnal Hukum Kenotariatan,S4,https://ojs.unud.ac.id/index.php/ActaComitas
2217,Legality : Jurnal Ilmiah Hukum,S4,http://ejournal.umm.ac.id/index.php/legality
2218,Jurnal Manajemen,S4,http://ejournal.atmajaya.ac.id/index.php/JM
2219,"Jurnal Komunika: Jurnal Komunikasi, Media dan Informatika",S4,https://jurnal.kominfo.go.id/index.php/komunika
2220,Jurnal Aisyah : Jurnal Ilmu Kesehatan,S4,http://ejournal.stikesaisyah.ac.id/index.php/jika/index
2221,Jurnal Ilmiah Soulmath : Jurnal Edukasi Pendidikan Matematika,S4,https://ejournal.unitomo.ac.id/index.php/mipa
2222,Jurnal IPTEKS Pemanfaatan Sumberdaya Perikanan,S4,http://journal.unhas.ac.id/index.php/iptekspsp
2223,Al-Munzir,S4,http://ejournal.iainkendari.ac.id/index.php/al-munzir
2224,JKG (Jurnal Komunikasi Global),S4,http://jurnal.unsyiah.ac.id/JKG/index
2225,Jurnal Ilmu Manajemen (JIM),S4,https://jurnalmahasiswa.unesa.ac.id/index.php/jim
2226,Jurnal Penelitian Sains,S4,http://ejurnal.mipa.unsri.ac.id/index.php/jps
2227,Jurnal Mangifera Edu,S4,https://jurnal.biounwir.ac.id/index.php/mangiferaedu
2228,"PENDIPA: Jurnal Pendidikan Sains, Universitas Bengkulu",S4,https://ejournal.unib.ac.id/index.php/pendipa
2229,Jurnal Ilmiah Keperawatan Sai Betik,S4,http://ejurnal.poltekkes-tjk.ac.id/index.php/JKEP
2230,"AdMathEdu : Jurnal Ilmiah Pendidikan Matematika, Ilmu Matematika dan Matematika Terapan",S4,http://journal.uad.ac.id/index.php/AdMathEdu/index
2231,Bioeksperimen: Jurnal Penelitian Biologi,S4,http://journals.ums.ac.id/index.php/bioeksperimen/index
2232,"Jurnal Ilmiah Ar-Risalah : Media Ke-Islaman, Pendidikan, dan Hukum Islam",S4,http://ejournal.iaiibrahimy.ac.id/index.php/arrisalah
2233,MPI (Media Pharmaceutica Indonesiana),S4,http://journal.ubaya.ac.id/index.php/MPI
2234,JIPI (JURNAL ILMU PERPUSTAKAAN DAN INFORMASI),S4,http://jurnal.uinsu.ac.id/index.php/jipi
2235,Wiyata Dharma: Jurnal Penelitian dan Evaluasi Pendidikan,S4,http://jurnal.ustjogja.ac.id/index.php/wd
2236,Jurnal Keperawatan Terapan (e-Journal),S4,http://ojs.poltekkes-malang.ac.id/index.php/JKT
2237,Journal of Midwifery,S4,http://jom.fk.unand.ac.id/index.php/jom
2238,Jurnal Varian,S4,https://journal.universitasbumigora.ac.id/index.php/Varian
2239,Jurnal Muara : Ilmu Ekonomi dan Bisnis,S4,https://journal.untar.ac.id/index.php/jmieb
2240,Jurnal Pendidikan Biologi undiksha,S4,https://ejournal.undiksha.ac.id/index.php/JJPB
2241,E-DIMAS: Jurnal Pengabdian kepada Masyarakat,S4,http://journal.upgris.ac.id/index.php/e-dimas/
2242,Hasanuddin Economics and Business Review,S4,http://pasca.unhas.ac.id/ojs/index.php/hebr
2243,Elite : English and Literature Journal,S4,http://journal.uin-alauddin.ac.id/index.php/elite
2244,Jurnal Golden Age,S4,http://e-journal.hamzanwadi.ac.id/index.php/jga
2245,Media Keperawatan Indonesia,S4,https://jurnal.unimus.ac.id/index.php/mki
2246,Jurnal Math Educator Nusantara (JMEN) : Wahana Publikasi Karya Tulis Ilmiah di Bidang Pendidikan Matematika,S4,http://ojs.unpkediri.ac.id/index.php/matematika/index
2247,Jurnal FishtecH,S4,http://ejournal.unsri.ac.id/index.php/fishtech
2248,Jurnal Biosains,S4,http://jurnal.unimed.ac.id/2012/index.php/biosains
2249,Jurnal Riset Hesti Medan Akper Kesdam I/BB Medan,S4,https://jurnal.kesdammedan.ac.id/index.php/jurhesti
2250,Journal of Private and Commercial Law,S4,https://journal.unnes.ac.id/nju/index.php/jpcl
2251,NALAR: Jurnal Peradaban dan Pemikiran Islam,S4,http://e-journal.iain-palangkaraya.ac.id/index.php/nalar
2252,Journal of Malay Islamic Studies,S4,http://jurnal.radenfatah.ac.id/index.php/jmis
2253,Perspektif,S4,http://ojs.uma.ac.id/index.php/perspektif
2254,Jurnal Sains dan Kesehatan,S4,https://jsk.farmasi.unmul.ac.id/index.php/jsk
2255,Jurnal Dedikasi Pendidikan,S4,http://jurnal.abulyatama.ac.id/dedikasi
2256,Soepra Jurnal Hukum Kesehatan,S4,http://journal.unika.ac.id/index.php/shk
2257,PINUS: Jurnal Penelitian Inovasi Pembelajaran,S4,http://ojs.unpkediri.ac.id/index.php/pinus
2258,Tesa Arsitektur,S4,http://journal.unika.ac.id/index.php/tesa
2259,Jurnal Media Analis Kesehatan,S4,http://journal.poltekkes-mks.ac.id/ojs2/index.php/mediaanalis
2260,JPI (Jurnal Pendidikan Inklusi),S4,https://journal.unesa.ac.id/index.php/ji
2261,Jurnal POLIMESIN,S4,http://e-jurnal.pnl.ac.id/index.php/polimesin/index
2262,"EnJourMe (English Journal of Merdeka) : Culture, Language, and Teaching of English",S4,http://jurnal.unmer.ac.id/index.php/enjourme
2263,Lex Scientia Law Review,S4,https://journal.unnes.ac.id/sju/index.php/lslr
2264,Jurnal Pendidikan Matematika (JPM),S4,http://riset.unisma.ac.id/index.php/jpm/index
2265,"Jurnal EECCIS (electrics, electronics, communications, controls, informatics, systems)",S4,http://jurnaleeccis.ub.ac.id/index.php/eeccis
2266,JURNAL PSIKOLOGI UDAYANA,S4,https://ojs.unud.ac.id/index.php/psikologi
2267,JPFT (Jurnal Pendidikan Fisika Tadulako Online),S4,http://jurnal.untad.ac.id/jurnal/index.php/EPFT/index
2268,Jurnal Teknologi Pangan dan Gizi (Jurnal of Food Technology and Nutrition),S4,http://journal.wima.ac.id/index.php/JTPG/index
2269,Jurnal Ilmiah Kesehatan,S4,https://journal.stikesmuh-pkj.ac.id/index.php/jik/
2270,JURNAL GOVERNANSI,S4,http://ojs.unida.ac.id/index.php/JGS
2271,Jurnal Pertanian,S4,http://ojs.unida.ac.id/index.php/jp/
2272,Tafaqquh: Jurnal Penelitian dan Kajian Keislaman,S4,http://jurnal.iaibafa.ac.id/index.php/tafaqquh/index
2273,Ijtihad : Jurnal Hukum dan Ekonomi Islam,S4,https://ejournal.unida.gontor.ac.id/index.php/ijtihad
2274,Journal Sampurasun : Interdisciplinary Studies for Cultural Heritage,S4,http://journal.unpas.ac.id/index.php/sampurasun/index
2275,Integralistik,S4,https://journal.unnes.ac.id/nju/index.php/integralistik/index
2276,Jurnal Pendidikan Akuntansi dan Keuangan,S4,http://ejournal.upi.edu/index.php/JPAK
2277,Jurnal Kesehatan Mesencephalon,S4,http://ejournal.stikeskepanjen-pemkabmalang.ac.id/index.php/mesencephalon
2278,International Journal of Engineering and Science Applications,S4,http://pasca.unhas.ac.id/ojs/index.php/ijesca
2279,Humani (Hukum dan Masyarakat Madani),S4,http://journals.usm.ac.id/index.php/humani
2280,Gemassika : Jurnal Pengabdian Kepada Masyarakat,S4,http://jurnal.stikes-aisyiyah.ac.id/index.php/gemassika/index
2281,Jurnal Produksi Tanaman,S4,http://protan.studentjournal.ub.ac.id/index.php/protan
2282,EDUTECH: Jurnal Ilmu Pendidikan dan Ilmu Sosial,S4,http://jurnal.umsu.ac.id/index.php/edutech
2283,Jurnal Dinamika Vokasional Teknik Mesin,S4,https://journal.uny.ac.id/index.php/dynamika/index
2284,Logista: Jurnal Ilmiah Pengabdian kepada Masyarakat,S4,http://logista.fateta.unand.ac.id/index.php/logista
2285,Jurnal Pengabdian Pada Masyarakat,S4,http://ppm.ejournal.id
2286,JST (Jurnal Sains Terapan),S4,http://jurnal.poltekba.ac.id/index.php/jst
2287,Agregat: Jurnal Ekonomi dan Bisnis,S4,http://journal.uhamka.ac.id/index.php/agregat/index
2288,Intiqad: Jurnal Agama dan Pendidikan Islam,S4,http://jurnal.umsu.ac.id/index.php/intiqad/index
2289,Medina-Te : Jurnal Studi Islam,S4,http://jurnal.radenfatah.ac.id/index.php/medinate
2290,"Jurnal Saintekom (Sain, Teknologi, Komputer dan Manajeman)",S4,http://stmikplk.ac.id/jurnal/index.php/saintekom
2291,Jurnal Solma,S4,https://journal.uhamka.ac.id/index.php/solma
2292,Global Review of Islamic Economics and Business,S4,http://ejournal.uin-suka.ac.id/febi/grieb
2293,Al-Falah: Journal of Islamic Economics,S4,http://journal.staincurup.ac.id/index.php/alfalah
2294,JITE (Journal of Informatics and Telecommunication Engineering),S4,https://ojs.uma.ac.id/index.php/jite/index
2295,Martabat: Jurnal Perempuan dan Anak,S4,http://ejournal.iain-tulungagung.ac.id/index.php/martabat
2296,Journal of Community Engagement in Health,S4,https://jceh.org/index.php/JCEH
2297,Gorontalo Journal of Government and Political Studies,S4,http://jurnal.unigo.ac.id/index.php/gjgops
2298,Jurnal Agrium,S4,https://ojs.unimal.ac.id/index.php/agrium
2299,Jurnal Edutech Undiksha,S4,https://ejournal.undiksha.ac.id/index.php/JEU
2300,Jurnal Ekonomi Syariah Indonesia (JESI),S4,http://ejournal.almaata.ac.id/index.php/JESI
2301,Jurnal Teknik Kimia,S4,http://ejournal.upnjatim.ac.id/index.php/tekkim
2302,Spirit Publik : Jurnal Administrasi Publik,S4,https://jurnal.uns.ac.id/spirit-publik
2303,Tarbawiyah: Jurnal Ilmiah Pendidikan,S4,http://e-journal.metrouniv.ac.id/index.php/tarbawiyah
2304,Jurnal Syarikah : Jurnal Ekonomi Islam,S4,http://ojs.unida.ac.id/index.php/JSEI
2305,Energi dan Kelistrikan: Jurnal Ilmiah,S4,https://stt-pln.e-journal.id/energi
2306,JDE (Journal of Developing Economies),S4,https://e-journal.unair.ac.id/index.php/JDE
2307,IJAIT (International Journal of Applied Information Technology),S4,https://journals.telkomuniversity.ac.id/ijait
2308,Supremasi Hukum: Jurnal Penelitian Hukum,S4,https://ejournal.unib.ac.id/index.php/supremasihukum
2309,Efektor,S4,http://ojs.unpkediri.ac.id/index.php/efektor-e
2310,JED (Jurnal Etika Demokrasi),S4,https://journal.unismuh.ac.id/index.php/jed/
2311,Jurnal Belantara,S4,http://belantara.unram.ac.id/index.php/JBL/index
2312,Jurnal Ilmu Hukum: Fakultas Hukum Universitas Riau,S4,https://jih.ejournal.unri.ac.id/index.php/JIH
2313,Journal Psikogenesis,S4,http://academicjournal.yarsi.ac.id/index.php/Jurnal-Online-Psikogenesis/index
2314,Indonesian Journal of Medicine,S4,http://www.theijmed.com/index.php?journal=theijmed
2315,Journal of Issues in Midwifery,S4,https://joim.ub.ac.id/index.php/joim
2316,Jurnal Teknologi Pangan,S4,http://ejournal.upnjatim.ac.id/index.php/teknologi-pangan
2317,Jurnal Perilaku dan Strategi Bisnis,S4,http://ejurnal.mercubuana-yogya.ac.id/index.php/JPSB
2318,Pertanian Tropik,S4,https://jurnal.usu.ac.id/index.php/tropik/index
2319,Jurnal Penelitian dan Pengabdian Kepada Masyarakat UNSIQ,S4,https://ojs.unsiq.ac.id/index.php/ppkm
2320,Sabda : Jurnal Kajian Kebudayaan,S4,http://ejournal.undip.ac.id/index.php/sabda
2321,Jurnal Sains dan Teknologi: Jurnal Keilmuan dan Aplikasi Teknologi Industri,S4,http://ojs.sttind.ac.id/sttind_ojs/index.php/Sain/index
2322,Maspari Journal : Marine Science Research,S4,https://ejournal.unsri.ac.id/index.php/maspari
2323,An Nabighoh,S4,http://e-journal.metrouniv.ac.id/index.php/an-nabighoh
2324,Kertha Wicaksana: Sarana Komunikasi Dosen dan Mahasiswa,S4,http://ejournal.warmadewa.ac.id/index.php/kertawicaksana
2325,SELING: Jurnal Program Studi PGRA,S4,http://jurnal.stitnualhikmah.ac.id/index.php/seling
2326,Jurnal Ekonomi Manajemen,S4,http://jurnal.unsil.ac.id/index.php/jem/index
2327,Journal of Vocational and Career Education,S4,https://journal.unnes.ac.id/nju/index.php/jvce/index
2328,JAST : Jurnal Aplikasi Sains dan Teknologi,S4,https://jurnal.unitri.ac.id/index.php/jast
2329,JRSI (Jurnal Rekayasa Sistem dan Industri),S4,http://jrsi.sie.telkomuniversity.ac.id/index.php/JRSI
2330,Journal of English Language and Pedagogy,S4,http://jurnal.ustjogja.ac.id/index.php/ELP
2331,Jurnal Ilmiah Teknik Elektro Komputer dan Informatika (JITEKI),S4,http://journal.uad.ac.id/index.php/JITEKI/
2332,Kilat,S4,https://stt-pln.e-journal.id/kilat
2333,Jurnal Riset Inspirasi Manajemen dan Kewirausahaan,S4,http://ejurnal.stimi-bjm.ac.id/index.php/JRIMK
2334,Jurnal Riset Akuntansi (JUARA),S4,http://ojs.unmas.ac.id/index.php/JUARA
2335,"Jurnal Bahasa, Sastra, dan Pembelajarannya (JBSP)",S4,https://ppjp.ulm.ac.id/journal/index.php/jbsp
2336,Exposure : Jurnal Pendidikan Bahasa Inggris,S4,http://journal.unismuh.ac.id/index.php/exposure
2337,Jurnal Imiah Pendidikan dan Pembelajaran,S4,https://ejournal.undiksha.ac.id/index.php/JIPP
2338,"Jurnal Muara Sains, Teknologi, Kedokteran, dan Ilmu Kesehatan",S4,http://journal.untar.ac.id/index.php/jmistki
2339,Jurnal Manajemen (Edisi Elektronik),S4,http://ejournal.uika-bogor.ac.id/index.php/manajemen
2340,Jurnal Ilmu Keperawatan Jiwa,S4,https://journal.ppnijateng.org/index.php/jikj
2341,At-Ta'lim : Media Informasi Pendidikan Islam,S4,https://ejournal.iainbengkulu.ac.id/index.php/attalim
2342,"Paedagoria : Jurnal Kajian, Penelitian dan Pengembangan Kependidikan",S4,http://journal.ummat.ac.id/index.php/paedagoria
2343,International Journal of Indonesian Education and Teaching (IJIET),S4,http://e-journal.usd.ac.id/index.php/IJIET
2344,Jurnal Akademika Baiturrahim Jambi,S4,http://jab.stikba.ac.id/index.php/jab
2345,JWM (Jurnal Wawasan Manajemen),S4,http://jwm.ulm.ac.id/id/index.php/jwm
2346,Jurnal Pendidikan Ekonomi Undiksha,S4,https://ejournal.undiksha.ac.id/index.php/JJPE
2347,JARI : Jurnal Akuakultur Rawa Indonesia,S4,https://ejournal.unsri.ac.id/index.php/jari
2348,Teknoin,S4,https://journal.uii.ac.id/jurnal-teknoin
2349,Medika Respati : Jurnal Ilmiah Kesehatan,S4,http://medika.respati.ac.id/index.php/Medika
2350,Jurnal Komunikasi,S4,http://journal.uii.ac.id/jurnal-komunikasi
2351,Paudia : Jurnal Penelitian dalam Bidang Pendidikan Anak Usia Dini,S4,http://journal.upgris.ac.id/index.php/paudia
2352,Jurnal Pendidikan Ekonomi (JPE) ,S4,http://journal2.um.ac.id/index.php/jpe/
2353,Jurnal Ilmiah Platax,S4,https://ejournal.unsrat.ac.id/index.php/platax
2354,English Education: Jurnal Tadris Bahasa Inggris,S4,http://ejournal.radenintan.ac.id/index.php/ENGEDU
2355,Husada Mahakam: Jurnal Kesehatan,S4,http://husadamahakam.poltekkes-kaltim.ac.id/ojs/index.php/Home
2356,Arkhais: Jurnal Ilmu Bahasa dan Sastra Indonesia,S4,http://journal.unj.ac.id/unj/index.php/arkhais/index
2357,Jurnal BETA (Biosistem dan Teknik Pertanian),S4,https://ojs.unud.ac.id/index.php/beta
2358,Journal of Management and Business Review,S4,http://www.jmbr.ppm-school.ac.id/index.php/jmbr
2359,Jurnal Kesehatan Indonesia (The Indonesian Journal of Health),S4,https://journal.stikeshb.ac.id/index.php/jurkessia/index
2360,"Jurnal Ilmiah MEA (Manajemen, Ekonomi, dan Akuntansi)",S4,http://journal.stiemb.ac.id/index.php/mea
2361,Jurnal Dimensi Fakultas Seni Rupa dan Desain,S4,http://www.trijurnal.lemlit.trisakti.ac.id/index.php/dimensi
2362,Journal of Family Sciences,S4,http://journal.ipb.ac.id/index.php/jfs
2363,Fullerene Journal of Chemistry,S4,https://indochembull.com/index.php/fulerene
2364,Jurnal Ilmiah Syi'ar,S4,https://ejournal.iainbengkulu.ac.id/index.php/syiar/index
2365,Jurnal Manajemen Pelayanan Publik,S4,http://jurnal.unpad.ac.id/jmpp
2366,Tik Ilmeu : Jurnal Ilmu Perpustakaan dan Informasi,S4,http://journal.staincurup.ac.id/index.php/TI/index
2367,Common: Jurnal Program Studi Ilmu Komunikasi FISIP Unikom,S4,https://ojs.unikom.ac.id/index.php/common
2368,Al-Tarbawi Al-Haditsah : Jurnal Pendidikan Islam,S4,http://www.syekhnurjati.ac.id/jurnal/index.php/tarbawi
2369,Jurnal Kepemimpinan dan Manajemen Keperawatan,S4,https://journal.ppnijateng.org/index.php/jkmk
2370,Journal of Nursing Care,S4,http://jurnal.unpad.ac.id/jnc
2371,JURNAL TEKNIK SIPIL,S4,http://puslit2.petra.ac.id/ejournal/index.php/jurnal-teknik-sipil
2372,JSM (Jurnal Surya Medika),S4,http://journal.umpalangkaraya.ac.id/index.php/jsm
2373,Jurnal Ekonomi dan Bisnis Jagaditha,S4,https://ejournal.warmadewa.ac.id/index.php/jagaditha
2374,Jurnal Jurnalisa : Jurnal Jurusan Jurnalistik,S4,http://journal.uin-alauddin.ac.id/index.php/jurnalisa/index
2375,Mathline : Jurnal Matematika dan Pendidikan Matematika,S4,https://mathline.unwir.ac.id/index.php/Mathline
2376,Mahkamah: Jurnal Kajian Hukum Islam,S4,http://www.syekhnurjati.ac.id/jurnal/index.php/mahkamah
2377,JURNAL INDRIA: Jurnal Ilmiah Pendidikan Prasekolah dan Sekolah Awal,S4,http://journal.umpo.ac.id/index.php/indria/issue/archive
2378,JSHP (Jurnal Sosial Humaniora dan Pendidikan),S4,https://jurnal.poltekba.ac.id/index.php/jsh
2379,Journal of Nursing Care and Biomolecular,S4,http://jnc.stikesmaharani.ac.id/index.php/JNC
2380,Jurnal Riset Ekonomi dan Bisnis,S4,http://journals.usm.ac.id/index.php/jreb
2381,International Journal of Law Reconstruction,S4,http://jurnal.unissula.ac.id/index.php/lawreconstruction
2382,PUBLIS (Publication Library and Information Science),S4,http://journal.umpo.ac.id/index.php/PUBLIS
2383,Agrotekma: Jurnal Agroteknologi dan Ilmu Pertanian,S4,http://ojs.uma.ac.id/index.php/agrotekma
2384,JOSSAE (Journal of Sport Science and Education),S4,https://journal.unesa.ac.id/index.php/jossae
2385,Religi : Jurnal Studi Agama-agama,S4,http://ejournal.uin-suka.ac.id/ushuluddin/Religi
2386,Bioscience,S4,http://ejournal.unp.ac.id/index.php/bioscience
2387,"Anuva: Jurnal Kajian Budaya, Perpustakaan, dan Informasi",S4,https://ejournal2.undip.ac.id/index.php/anuva/index
2388,Stilistika: Jurnal Pendidikan Bahasa dan Sastra,S4,http://journal.um-surabaya.ac.id/index.php/Stilistika/index
2389,Perspektif Komunikasi: Jurnal Ilmu Komunikasi Politik dan Komunikasi Bisnis,S4,https://jurnal.umj.ac.id/index.php/perspektif
2390,Edukasi : Jurnal Penelitian dan Artikel Pendidikan,S4,http://journal.ummgl.ac.id/index.php/edukasi
2391,NERS:Jurnal Keperawatan,S4,http://ners.fkep.unand.ac.id/
2392,Techne : Jurnal Ilmiah Elektroteknika,S4,http://ojs.jurnaltechne.org/index.php/techne/index
2393,Jurnal Pendidikan Bahasa,S4,http://journal.ikippgriptk.ac.id/index.php/bahasa
2394,SYSTEMIC: Information System and Informatics Journal,S4,http://jurnalsaintek.uinsby.ac.id/index.php/SYSTEMIC
2395,Tarbawi : Jurnal Pendidikan Agama Islam,S4,https://journal.unismuh.ac.id/index.php/tarbawi
2396,Multilateral: Jurnal Pendidikan Jasmani Dan Olahraga,S4,https://ppjp.ulm.ac.id/journal/index.php/multilateralpjkr/index
2397,Agrisaintifika: Jurnal Ilmu-Ilmu Pertanian,S4,http://jurnal.agrisaintifika-fpunivet.ac.id/index.php
2398,JOISIE (Journal Of Information Systems And Informatics Engineering),S4,http://www.ejournal.pelitaindonesia.ac.id/ojs32/index.php/JOISIE
2399,Sains Medika : Jurnal Kedokteran dan Kesehatan,S4,http://jurnal.unissula.ac.id/index.php/sainsmedika/issue/archive
2400,"MUST: Journal of Mathematics Education, Science and Technology",S4,http://journal.um-surabaya.ac.id/index.php/matematika
2401,Jurnal Ilmiah Biosaintropis (BIOSCIENCE-TROPIC),S4,http://biosaintropis.unisma.ac.id
2402,Inovasi Pembangunan : Jurnal Kelitbangan,S4,http://journalbalitbangdalampung.org/index.php/jip
2403,JURNAL FONDASI,S4,http://jurnal.untirta.ac.id/index.php/jft
2404,Dinamisia : Jurnal Pengabdian Kepada Masyarakat,S4,https://journal.unilak.ac.id/index.php/dinamisia/index
2405,Iltizam Journal of Shariah Economic Research,S4,http://e-journal.lp2m.uinjambi.ac.id/ojp/index.php/iltizam/INDEXING
2406,Syntax Literate : Jurnal Ilmiah Indonesia,S4,http://www.jurnal.syntaxliterate.co.id/index.php/syntax-literate
2407,Kajian Linguistik dan Sastra,S4,http://journals.ums.ac.id/index.php/KLS
2408,PROJECT (Professional Journal of English Education),S4,https://journal.ikipsiliwangi.ac.id/index.php/project
2409,Jurnal Pendidikan Dasar Nusantara,S4,http://ojs.unpkediri.ac.id/index.php/pgsd
2410,Jurnal Pelita Pendidikan,S4,http://jurnal.unimed.ac.id/2012/index.php/pelita/index
2411,Lex Jurnalica,S4,https://ejurnal.esaunggul.ac.id/index.php/Lex
2412,Chimica et Natura Acta,S4,http://jurnal.unpad.ac.id/jcena/index
2413,Jurnal Plastik Rekonstruksi,S4,http://www.jprjournal.com/index.php/jpr
2414,"Jurnal Ilmiah Muqoddimah : Jurnal Ilmu Sosial, Politik, dan Humaniora",S4,http://jurnal.um-tapsel.ac.id/index.php/muqoddimah
2415,Jurnal Inovasi Ekonomi,S4,http://ejournal.umm.ac.id/index.php/JIKO/index
2416,Hang Tuah Law Journal,S4,http://law-journal.hangtuah.ac.id/index.php/htlj
2417,Wardah,S4,http://jurnal.radenfatah.ac.id/index.php/warda
2418,Petir: Jurnal Pengkajian dan Penerapan Teknik Informatika,S4,https://stt-pln.e-journal.id/petir/issue/view/1
2419,Ibriez : Jurnal Kependidikan Dasar Islam Berbasis Sains,S4,http://ibriez.iainponorogo.ac.id/index.php/ibriez
2420,Liquidity: Jurnal Riset Akuntansi dan Manajemen,S4,http://ojs.itb-ad.ac.id/index.php/LQ
2421,Kesmas Indonesia,S4,http://jos.unsoed.ac.id/index.php/kesmasindo/
2422,Jurnal Nomosleca,S4,http://jurnal.unmer.ac.id/index.php/n
2423,Jurnal Pemikiran dan Penelitian Psikologi Insight,S4,http://jurnal.unmuhjember.ac.id/index.php/INSIGHT
2424,VANOS Journal of Mechanical Engineering Education,S4,https://jurnal.untirta.ac.id/index.php/vanos
2425,Jurnal Teknologi Agro-Industri,S4,http://jtai.politala.ac.id/index.php/JTAI
2426,Chempublish Journal,S4,https://online-journal.unja.ac.id/chp
2427,Jurnal Sains dan Teknologi Pangan,S4,http://ojs.uho.ac.id/index.php/jstp
2428,Journal of Aceh Physics Society,S4,http://www.jurnal.unsyiah.ac.id/JAcPS/index
2429,E-Jurnal Ekonomi dan Bisnis Universitas Udayana,S4,https://ojs.unud.ac.id/index.php/EEB/index
2430,"Jurnal Ecotipe (Electronic, Control, Telecommunication, Information, and Power Engineering)",S4,http://journal.ubb.ac.id/index.php/ecotipe
2431,Jurnal Elemen,S4,http://je.politala.ac.id/index.php/JE
2432,Jurnal Teknik : Media Pengembangan Ilmu dan Aplikasi Teknik,S4,http://jurnalteknik.unjani.ac.id/index.php/jt
2433,Jurnal Ilmiah Farmasi Farmasyifa (JIFF),S4,https://ejournal.unisba.ac.id/index.php/Farmasyifa/index
2434,Cendekia Journal of Pharmacy,S4,https://cjp.jurnal.stikescendekiautamakudus.ac.id/index.php/cjp/index
2435,Jurnal Agronida,S4,http://ojs.unida.ac.id/index.php/JAG
2436,Journal of Applied Informatics and Computing (JAIC),S4,https://jurnal.polibatam.ac.id/index.php/jaic
2437,Jetri : Jurnal Ilmiah Teknik Elektro,S4,http://www.trijurnal.lemlit.trisakti.ac.id/index.php/jetri
2438,Quagga: Jurnal Pendidikan dan Biologi,S4,https://journal.uniku.ac.id/index.php/quagga
2439,Jurnal Harkat : Media Komunikasi Gender,S4,http://journal.uinjkt.ac.id/index.php/psga/index
2440,Expose: Jurnal Ilmu Komunikasi,S4,http://e-journal.president.ac.id/presunivojs/index.php/EXPOSE
2441,International Journal of Applied Business and International Management ,S4,http://ejournal.aibpm.org/index.php/IJABIM
2442,Progresif: Jurnal Ilmiah Komputer,S4,http://ojs.stmik-banjarbaru.ac.id/index.php/progresif
2443,Sriwijaya Journal of Environment,S4,http://ojs.pps.unsri.ac.id/index.php/ppsunsri/issue/archive
2444,SCHOOL EDUCATION JOURNAL PGSD FIP UNIMED,S4,http://jurnal.unimed.ac.id/2012/index.php/school/
2445,Life Science,S4,https://journal.unnes.ac.id/sju/index.php/UnnesJLifeSci
2446,Jurnal Budidaya Pertanian,S4,https://ojs3.unpatti.ac.id/index.php/bdp/
2447,JPM (Jurnal Pemberdayaan Masyarakat),S4,http://ejournal.unikama.ac.id/index.php/jpm/issue/archive
2448,Jurnal Ilmu Alam dan Lingkungan,S4,http://journal.unhas.ac.id/index.php/jai2
2449,JOINS (Journal Of information System),S4,http://publikasi.dinus.ac.id/index.php/joins
2450,Productum Jurnal Desain Produk (Pengetahuan dan Perancangan Produk),S4,http://journal.isi.ac.id/index.php/PRO
2451,Oceana Biomedicina Journal,S4,http://ocean-biomedicina.hangtuah.ac.id/index.php/journal/index
2452,Jurnal Manajemen dan Bisnis (Performa),S4,https://ejournal.unisba.ac.id/index.php/performa/index
2453,Jurnal Penelitan Ekonomi dan Bisnis,S4,http://publikasi.dinus.ac.id/index.php/jpeb
2454,Jusikom : Jurnal Sistem Komputer Musirawas,S4,http://jurnal.univbinainsan.ac.id/index.php/jusikom
2455,Visualita: Jurnal Online Desain Komunikasi Visual,S4,https://ojs.unikom.ac.id/index.php/visualita/
2456,Wawasan Kesehatan : Jurnal Ilmiah Ilmu Kesehatan,S4,http://journal.stikes-kapuasraya.ac.id/index.php/JIIK-WK
2457,JIP (Jurnal Ilmiah PGMI),S4,http://jurnal.radenfatah.ac.id/index.php/jip
2458,Jurnal Ilmu Keperawatan dan Kebidanan,S4,http://ejr.stikesmuhkudus.ac.id/index.php/jikk
2459,Jurnal Ilmu Dakwah,S4,http://journal.walisongo.ac.id/index.php/dakwah
2460,Jurnal Ilmu Keperawatan : Journal of Nursing Science,S4,http://jik.ub.ac.id/index.php/jik
2461,At-Tajdid: Jurnal Ilmu Tarbiyah,S4,http://ejournal.stitmuhpacitan.ac.id/index.php/tajdid
2462,Forum Agribisnis : Agribusiness Forum,S4,http://journal.ipb.ac.id/index.php/fagb/index
2463,MENDIDIK: Jurnal Kajian Pendidikan dan Pengajaran,S4,http://ojs.ejournal.id/index.php/mendidik/index
2464,Iqtishodia : Jurnal Ekonomi Syariah,S4,http://ejournal.alqolam.ac.id/index.php/iqtishodia
2465,Al-Fikrah: Jurnal Manajemen Pendidikan,S4,http://ecampus.iainbatusangkar.ac.id/ojs/index.php/alfikrah
2466,EL MUHASABA: Jurnal Akuntansi,S4,http://ejournal.uin-malang.ac.id/index.php/el-muhasaba
2467,Jurnal Mettek: Jurnal Ilmiah Nasional dalam Bidang Ilmu Teknik Mesin,S4,https://ojs.unud.ac.id/index.php/mettek
2468,Idealog: Ide dan Dialog Desain Indonesia,S4,http://journals.telkomuniversity.ac.id/idealog
2469,"Jurnal Ilmiah Mizani: Wacana Hukum, Ekonomi Dan Keagamaan",S4,https://ejournal.iainbengkulu.ac.id/index.php/mizani/
2470,"Jurisprudensi : Jurnal Ilmu Syariah, Perundangan-Undangan dan Ekonomi Islam",S4,https://journal.iainlangsa.ac.id/index.php/jurisprudensi
2471,Data Science: Journal of Computing and Applied Informatics,S4,https://talenta.usu.ac.id/JoCAI
2472,English Community Journal,S4,http://jurnal.um-palembang.ac.id/index.php/englishcommunity/index
2473,Melayunesia Law,S4,https://myl.ejournal.unri.ac.id/index.php/ML
2474,JPEP (Jurnal Progres Ekonomi Pembangunan) ,S4,http://ojs.uho.ac.id/index.php/JPEP/
2475,JOALL (Journal of Applied Linguistics and Literature),S4,https://ejournal.unib.ac.id/index.php/joall/index
2476,"Alinea: Jurnal Bahasa, Sastra, dan Pengajaran",S4,https://jurnal.unsur.ac.id/index.php/ajbsi/
2477,Indonesian Journal of Biotechnology and Biodiversity,S4,https://ejurnal.esaunggul.ac.id/index.php/bio
2478,International Journal of Applied Biology,S4,http://journal.unhas.ac.id/index.php/ijoab/index
2479,"Journal of Accounting Research, Organization and Economics",S4,http://www.jurnal.unsyiah.ac.id/JAROE/index
2480,Journal of Japanese Language Education and Linguistics,S4,http://journal.umy.ac.id/index.php/jjlel/index
2481,Jurnal Kepemimpinan dan Pengurusan Sekolah,S4,http://ejurnal.stkip-pessel.ac.id/index.php/kp/
2482,Jurnal Penelitian Ilmu Pendidikan,S4,http://journal.uny.ac.id/index.php/jpip/index
2483,The New Ropanasuri Journal of Surgery,S4,http://www.nrjs.ui.ac.id/index.php/journal
2484,Journal of Food System and Agribusiness (JoFSA),S4,https://jurnal.polinela.ac.id/index.php/JFA
