journal_no,journal_name,journal_accreditation,journal_url
1,Jurnal Cakrawala Pendidikan,S1,http://journal.uny.ac.id/index.php/cp
2,Operations and Supply Chain Management: An International Journal,S1,http://journal.oscm-forum.org/
3,Journal on Mathematics Education,S1,http://ejournal.unsri.ac.id/index.php/jme
4,IJAL (Indonesian Journal of Applied Linguistics),S1,http://ejournal.upi.edu/index.php/IJAL
5,Buletin Ekonomi Moneter dan Perbankan,S1,https://www.bmeb-bi.org/index.php/BEMP/
6,Jurnal Pendidikan IPA Indonesia (Indonesian Journal of Science Education),S1,http://journal.unnes.ac.id/nju/index.php/jpii
7,"International Journal on Advanced Science, Engineering and Information Technology (IJASEIT)",S1,http://ijaseit.insightsociety.org/
8,Forest and Society,S1,http://journal.unhas.ac.id/index.php/fs/index
9,International Journal of Electrical and Computer Engineering,S1,http://iaesjournal.com/online/index.php/IJECE
10,Journal of the Indonesian Tropical Animal Agriculture,S1,http://ejournal.undip.ac.id/index.php/jitaa
11,Bulletin of Electrical Engineering and Informatics,S1,http://journal.portalgaruda.org/index.php/EEI
12,Journal of Engineering and Technological Sciences,S1,http://journals.itb.ac.id/index.php/jets
13,Gadjah Mada International Journal of Business (GamaIJB),S1,https://jurnal.ugm.ac.id/gamaijb
14,Indonesian Journal of Islam and Muslim Societies,S1,http://ijims.iainsalatiga.ac.id
15,IJAIN (International Journal of Advances in Intelligent Informatics) ,S1,http://ijain.org/index.php/IJAIN
16,Journal of Mathematical and Fundamental Sciences,S1,http://journals.itb.ac.id/index.php/jmfs
17,Indonesian Journal of Science and Technology,S1,http://ejournal.upi.edu/index.php/ijost/
18,International Journal of Evaluation and Research in Education (IJERE),S1,http://ijere.iaescore.com
19,Biodiversitas : Journal of Biolodical Diversity,S1,http://biodiversitas.mipa.uns.ac.id/
20,Studia Islamika,S1,http://journal.uinjkt.ac.id/index.php/studia-islamika
21,Tropical Animal Science Journal,S1,http://journal.ipb.ac.id/index.php/mediapeternakan
22,International Journal of Renewable Energy Development : JRED,S1,http://ejournal.undip.ac.id/index.php/ijred/index
23,Indonesian Journal of Electrical Engineering and Computer Science,S1,http://www.iaesjournal.com/online/index.php/IJEECS
24,Jurnal Ilmu Ternak dan Veteriner,S1,http://medpub.litbang.pertanian.go.id/index.php/jitv/index
25,Indonesian Journal of Electrical Engineering and Informatics,S1,http://section.iaesonline.com/index.php/IJEEI/index
26,TELKOMNIKA (Telecommunication Computing Electronics and Control),S1,http://journal.uad.ac.id/index.php/telkomnika
27,IJOG : Indonesian Journal on Geoscience,S1,https://ijog.geologi.esdm.go.id/index.php/IJOG
28,QIJIS (Qudus International Journal Of Islamic Studies),S1,http://journal.stainkudus.ac.id/index.php/QIJIS
29,Atom Indonesia,S1,http://aij.batan.go.id
30,"AGRIVITA, Journal of Agricultural Science (AJAS)",S1,https://agrivita.ub.ac.id/index.php/agrivita
31,HAYATI Journal of Biosciences,S1,http://journal.ipb.ac.id/index.php/hayati/
32,Journal of Degraded and Mining Lands Management,S1,http://jdmlm.ub.ac.id/index.php/jdmlm/index
33,JSP (Jurnal Ilmu Sosial dan Ilmu Politik),S1,https://jurnal.ugm.ac.id/index.php/jsp
34,Indonesian Journal of Chemistry,S1,https://jurnal.ugm.ac.id/ijc
35,BIOTROPIA,S1,http://journal.biotrop.org/index.php/biotropia
36,Indonesian Journal of Biotechnology,S1,https://jurnal.ugm.ac.id/ijbiotech/
37,Al-Jami'ah: Journal of Islamic Studies,S1,http://www.aljamiah.or.id
38,Bulletin of Chemical Reaction Engineering & Catalysis,S1,https://ejournal2.undip.ac.id/index.php/bcrec
39,Journal of Regional and City Planning,S1,http://journals.itb.ac.id/index.php/jpwk
40,Indonesian Journal of Forestry Research,S1,http://ejournal.forda-mof.org/ejournal-litbang/index.php/IJFR
41,Indonesian Journal of Geography,S1,http://jurnal.ugm.ac.id/ijg/
42,The Indonesian Biomedical Journal,S1,http://inabj.org/index.php/ibj
43,Medical Journal of Indonesia,S1,http://mji.ui.ac.id/journal/index.php/mji
44,Indonesian Aquaculture Journal,S1,http://ejournal-balitbang.kkp.go.id/index.php/iaj
45,"Wacana, Journal of the Humanities of Indonesia",S1,http://wacana.ui.ac.id
46,Molekul : Jurnal Ilmiah Kimia,S1,https://ojs.jmolekul.com/ojs/index.php/jm
47,SAINS TANAH - Journal of Soil Science and Agroclimatology,S1,http://jurnal.fp.uns.ac.id/index.php/tanah/index
48,Journal of Indonesian Islam,S1,http://jiis.uinsby.ac.id/index.php/JIIs/index
49,Indonesian Journal of Pharmacy ,S1,http://indonesianjpharm.farmasi.ugm.ac.id/index.php/3
50,TEFLIN Journal,S1,http://journal.teflin.org/index.php/journal
51,International Journal of Power Electronics and Drive Systems,S1,http://iaesjournal.com/online/index.php/IJPEDS
52,International Journal on Electrical Engineering and Informatics,S1,http://www.ijeei.org/
53,Kesmas: Jurnal Kesehatan Masyarakat Nasional,S1,http://journal.fkm.ui.ac.id/kesmas/issue/archive
54,ACTA MEDICA INDONESIANA,S1,http://www.actamedindones.org/index.php/ijim
55,Jurnal Manajemen Hutan Tropika,S1,http://journal.ipb.ac.id/index.php/jmht/
56,Microbiology Indonesia,S1,http://jurnal.permi.or.id/index.php/mionline
57,Journal of ICT Research and Applications,S1,http://journals.itb.ac.id/index.php/jictra/index
58,Squalen Bulletin of Marine and Fisheries Postharvest and Biotechnology,S1,http://www.bbp4b.litbang.kkp.go.id/squalen-bulletin/index.php/squalen
59,Jurnal Respirologi Indonesia,S1,http://jurnalrespirologi.org/2015/07/
60,Paramita: Historical Studies Journal,S1,http://journal.unnes.ac.id/nju/index.php/paramita
61,Electronic Journal of Graph Theory and Applications,S1,http://www.ejgta.org/index.php/ejgta
62,Kukila,S1,http://kukila.org/index.php/KKL
63,International Journal of Technology,S1,http://www.ijtech.eng.ui.ac.id/old/index.php/journal
64,Critical Care and Shock,S1,http://criticalcareshock.org/
65,Forum Penelitian Agro Ekonomi,S2,http://ejurnal.litbang.pertanian.go.id/index.php/fae
66,Jurnal Aplikasi Manajemen,S2,http://jurnaljam.ub.ac.id/index.php/jam/index
67,Jurnal Penelitian Pascapanen Pertanian,S2,http://ejurnal.litbang.pertanian.go.id/index.php/jpasca
68,Jurnal Agronomi Indonesia (Indonesian Journal of Agronomy),S2,http://journal.ipb.ac.id/index.php/jurnalagronomi
69,Berita Biologi,S2,http://e-journal.biologi.lipi.go.id/index.php/berita_biologi
70,Jurnal Ekologi Kesehatan,S2,http://ejournal.litbang.depkes.go.id/index.php/jek/issue/archive
71,Riset Akuntansi dan Keuangan Indonesia,S2,http://journals.ums.ac.id/index.php/reaksi
72,Marine Research In Indonesia,S2,http://mrijournal.or.id/index.php/MRI
73,KEMAS : Jurnal Kesehatan Masyarakat,S2,http://journal.unnes.ac.id/nju/index.php/kemas
74,Buletin Plasma Nutfah,S2,http://ejurnal.litbang.pertanian.go.id/index.php/bpn
75,Jurnal Ilmu Teknologi Kayu Tropis,S2,http://ejournalmapeki.org/index.php/JITKT
76,JOIN (Jurnal Online Informatika),S2,http://join.if.uinsgd.ac.id/index.php/join
77,Buletin Penelitian Tanaman Rempah dan Obat,S2,http://ejurnal.litbang.pertanian.go.id/index.php/bultro
78,Analisis Kebijakan Pertanian,S2,http://ejurnal.litbang.pertanian.go.id/index.php/akp
79,Biosfer: Jurnal Pendidikan Biologi,S2,http://journal.unj.ac.id/unj/index.php/biosfer/index
80,Tadris: Jurnal keguruan dan Ilmu Tarbiyah,S2,http://ejournal.radenintan.ac.id/index.php/tadris
81,Jurnal Ilmu Pendidikan,S2,http://journal.um.ac.id/index.php/jip
82,Journal of Tropical Soils,S2,http://journal.unila.ac.id/index.php/tropicalsoil/index
83,EKUITAS : Jurnal Ekonomi dan Keuangan,S2,https://ejournal.stiesia.ac.id/ekuitas
84,Jurnal Ilmiah Pendidikan Fisika Al-Biruni,S2,http://ejournal.radenintan.ac.id/index.php/al-biruni/index
85,Jurnal Agro Ekonomi,S2,http://ejurnal.litbang.pertanian.go.id/index.php/jae
86,Jurnal PEKOMMAS,S2,https://jurnal.kominfo.go.id/index.php/pekommas/index
87,The South East Asian Journal of Management,S2,http://journal.ui.ac.id/tseajm
88,International Journal on Emerging Mathematics Education,S2,http://journal.uad.ac.id/index.php/IJEME/index
89,Jurnal Wilayah dan Lingkungan,S2,http://ejournal2.undip.ac.id/index.php/jwl
90,Jurnal Pendidikan Ekonomi & Bisnis (Edisi Elektronik),S2,http://journal.unj.ac.id/unj/index.php/jpeb/index
91,LITERA,S2,http://journal.uny.ac.id/index.php/ litera
92,Jurnal Pascapanen dan Bioteknologi Kelautan dan Perikanan,S2,http://www.bbp4b.litbang.kkp.go.id/jurnal-jpbkp/index.php/jpbkp/index
93,Jurnal Teknologi Lingkungan,S2,http://ejurnal.bppt.go.id/index.php/JTL/issue/archive
94,Al-Iqtishad : Jurnal Ilmu Ekonomi Syariah (Journal of Islamic Economics),S2,http://journal.uinjkt.ac.id/index.php/iqtishad
95,Majalah Geografi Indonesia,S2,https://jurnal.ugm.ac.id/mgi
96,Jurnal ASET (Akuntansi Riset),S2,http://ejournal.upi.edu/index.php/aset
97,Jurnal Ilmiah Perikanan dan Kelautan,S2,https://e-journal.unair.ac.id/JIPK
98,SCIENTIFIC DENTAL JOURNAL,S2,http://www.scidentj.com/
99,Jurnal Legislasi Indonesia,S2,http://e-jurnal.peraturan.go.id/index.php/jli/index
100,Jurnal Pendidikan dan Kebudayaan,S2,http://jurnaldikbud.kemdikbud.go.id/index.php/jpnk
101,Jurnal Pendidikan Teknologi dan Kejuruan,S2,https://journal.uny.ac.id/index.php/jptk
102,Journal of Southeast Asian Human Rights,S2,https://jurnal.unej.ac.id/index.php/JSEAHR
103,Jurnal Ilmiah Aplikasi Isotop dan Radiasi (A Scientific Journal for the Applications of Isotopes and Radiation),S2,http://jurnal.batan.go.id/index.php/jair
104,Jurnal Konseling dan Pendidikan,S2,http://jurnal.konselingindonesia.com/index.php/jkp
105,Buletin Palawija,S2,http://ejurnal.litbang.pertanian.go.id/index.php/bulpa/issue/archive
106,Indonesian Journal of Sustainability Accounting and Management ,S2,http://unpas.id/index.php/ijsam
107,Antropologi Indonesia,S2,http://journal.ui.ac.id/index.php/jai/index
108,Media Penelitian dan Pengembangan Kesehatan,S2,http://ejournal.litbang.depkes.go.id/index.php/MPK
109,Jurnal Ilmu Komputer dan Informasi,S2,http://jiki.cs.ui.ac.id/index.php/jiki
110,JRAMathEdu (Journal of Research and Advances in Mathematics Education),S2,http://journals.ums.ac.id/index.php/jramathedu/index
111,Nadwa : Jurnal Pendidikan Islam,S2,http://journal.walisongo.ac.id/index.php/Nadwa
112,Jurnal The Messenger,S2,http://journals.usm.ac.id/index.php/the-messenger/index
113,Automotive Experiences,S2,http://journal.ummgl.ac.id/index.php/AutomotiveExperiences/index
114,Indonesian Journal of Urban and Environmental Technology,S2,https://www.trijurnal.lemlit.trisakti.ac.id/urbanenvirotech
115,Jurnal Geografi,S2,http://jurnal.unimed.ac.id/2012/index.php/geo
116,JPBI (JURNAL PENDIDIKAN BIOLOGI INDONESIA),S2,http://ejournal.umm.ac.id/index.php/jpbi/index
117,Al-Jabar: Jurnal Pendidikan Matematika,S2,http://ejournal.radenintan.ac.id/index.php/al-jabar/index
118,Jurnal Teknik Industri,S2,http://ejournal.umm.ac.id/index.php/industri
119,Buletin Palma,S2,http://ejurnal.litbang.pertanian.go.id/index.php/palma
120,Jurnal Kependidikan: Penelitian Inovasi Pembelajaran,S2,http://journal.uny.ac.id/index.php/jk
121,Nyimak : Journal of Communication,S2,http://jurnal.umt.ac.id/index.php/nyimak
122,Jurnal PIKOM (Penelitian Komunikasi dan Pembangunan),S2,https://jurnal.kominfo.go.id/index.php/jpkp
123,Jurnal Elemen Program Studi Pendidikan Matematika STKIP Hamzanwadi Selong,S2,http://e-journal.hamzanwadi.ac.id/index.php/jel
124,Jurnal Penyuluhan,S2,http://journal.ipb.ac.id/index.php/jupe
125,Jurnal Teknologi dan Sistem Komputer,S2,https://jtsiskom.undip.ac.id/index.php/jtsiskom/index
126,KURIOS (Jurnal Teologi dan Pendidikan Agama Kristen),S2,http://www.sttpb.ac.id/e-journal/index.php/kurios
127,Journal of Contemporary Islam and Muslim Societies,S2,http://jurnal.uinsu.ac.id/index.php/JCIMS/index
128,Journal of Indonesian Economy and Business,S2,http://jurnal.ugm.ac.id/jieb/index
129,Jurnal Pendidikan Usia Dini,S2,http://journal.unj.ac.id/unj/index.php/jpud/
130,Jurnal Ners,S2,http://e-journal.unair.ac.id/index.php/JNERS/index
131,Kapata Arkeologi,S2,http://kapata-arkeologi.kemdikbud.go.id/index.php/kapata
132,Register: Jurnal Ilmiah Teknologi Sistem Informasi,S2,http://www.journal.unipdu.ac.id/index.php/register/index
133,Jurnal Studi Komunikasi,S2,http://ejournal.unitomo.ac.id/index.php/jsk
134,Jurnal Jaffray,S2,http://ojs.sttjaffray.ac.id/index.php/JJV71
135,IJCCS (Indonesian Journal of Computing and Cybernetics Systems) ,S2,https://jurnal.ugm.ac.id/ijccs
136,Signifikan : Jurnal Ilmu Ekonomi,S2,http://journal.uinjkt.ac.id/index.php/signifikan
137,JEELS (Journal of English Education and Linguistics Studies),S2,https://jurnal.iainkediri.ac.id/index.php/jeels/index
138,Jurnal Penelitian Hukum De Jure,S2,http://ejournal.balitbangham.go.id/index.php/dejure
139,Buletin Psikologi,S2,https://jurnal.ugm.ac.id/buletinpsikologi
140,Jurnal Ketahanan Nasional,S2,http://jurnal.ugm.ac.id/jkn
141,Infinity,S2,http://e-journal.stkipsiliwangi.ac.id/index.php/infinity
142,Jurnal Kajian Komunikasi ,S2,http://jurnal.unpad.ac.id/jkk
143,Jurnal Gizi Klinik Indonesia,S2,https://jurnal.ugm.ac.id/jgki
144,IJHN : Indonesian Journal of Human Nutrition,S2,http://ijhn.ub.ac.id/index.php/ijhn/index
145,Register Journal,S2,http://ijims.iainsalatiga.ac.id/index.php/register
146,Scientific Journal of Informatics,S2,https://journal.unnes.ac.id/nju/index.php/sji/index
147,Jurnal Pengolahan Hasil Perikanan Indonesia,S2,http://journal.ipb.ac.id/index.php/jphpi
148,Jurnal Riset Pendidikan Matematika,S2,http://journal.uny.ac.id/index.php/jrpm
149,Etikonomi,S2,http://journal.uinjkt.ac.id/index.php/etikonomi
150,Jurnal Teknologi Informasi dan Ilmu Komputer ,S2,http://jtiik.ub.ac.id/index.php/jtiik
151,Economica: Jurnal Ekonomi Islam,S2,http://journal.walisongo.ac.id/index.php/economica/index
152,Jurnal Hortikultura,S2,http://ejurnal.litbang.pertanian.go.id/index.php/jhort
153,International Journal of Education,S2,http://ejournal.upi.edu/index.php/ije/index
154,Indonesian Journal of Agricultural Science,S2,http://ejurnal.litbang.pertanian.go.id/index.php/ijas
155,Jurnal Hukum dan Peradilan,S2,http://www.jurnalhukumdanperadilan.org
156,Jurnal Agro Biogen,S2,http://ejurnal.litbang.pertanian.go.id/index.php/ja
157,Jurnal Profesi Humas,S2,http://jurnal.unpad.ac.id/profesi-humas/index
158,International Research Journal of Business Studies,S2,http://www.irjbs.com/index.php/jurnalirjbs/issue/archive
159,IJEIS (Indonesian Journal of Electronics and Instrumentation Systems),S2,https://jurnal.ugm.ac.id/ijeis
160,Jurnal Kefarmasian Indonesia,S2,http://ejournal.litbang.depkes.go.id/index.php/jki
161,Udayana Journal of Law and Culture,S2,https://ojs.unud.ac.id/index.php/UJLC/index
162,LAW REFORM,S2,http://ejournal.undip.ac.id/index.php/lawreform/index
163,Journal of Education and Learning,S2,http://journal.uad.ac.id/index.php/EduLearn
164,JPPPF (Jurnal Penelitian dan Pengembangan Pendidikan Fisika),S2,http://journal.unj.ac.id/unj/index.php/jpppf
165,Jurnal Gizi Indonesia (The Indonesian Journal of Nutrition),S2,https://ejournal.undip.ac.id/index.php/jgi/index
166,Jurnal Penelitian Fisika dan Aplikasinya (JPFA),S2,https://journal.unesa.ac.id/index.php/jpfa/index
167,Jurnal Kajian Bimbingan dan Konseling,S2,http://journal2.um.ac.id/index.php/jkbk
168,Bali Medical Journal,S2,https://balimedicaljournal.org/index.php/bmj
169,Jurnal Penelitian dan Evaluasi Pendidikan,S2,http://journal.uny.ac.id/index.php/jpep/index
170,Ketenagalistrikan dan Energi Terbarukan,S2,http://ketjurnal.p3tkebt.esdm.go.id/index.php/ket
171,Jurnal Perempuan,S2,http://www.indonesianfeministjournal.org
172,Ilmu Dakwah: Academic Journal for Homiletic Studies,S2,http://journal.uinsgd.ac.id/index.php/idajhs
173,Khazanah Informatika: Jurnal Ilmu Komputer dan Informatika,S2,http://journals.ums.ac.id/index.php/khif
174,Binus Business Review,S2,https://journal.binus.ac.id/index.php/BBR/index
175,Jurnal Penelitian Perikanan Indonesia,S2,http://ejournal-balitbang.kkp.go.id/index.php/jppi
176,AKRUAL: JURNAL AKUNTANSI,S2,https://journal.unesa.ac.id/index.php/aj/index
177,Humanus: Jurnal Ilmiah Ilmu-ilmu Humaniora,S2,http://ejournal.unp.ac.id/index.php/humanus
178,Naditira Widya,S2,https://naditirawidya.kemdikbud.go.id/index.php/nw
179,Jurnal Ilmiah Peuradeun,S2,http://journal.scadindependent.org/index.php/jipeuradeun
180,Cendekia: Jurnal Kependidikan dan Kemasyarakatan,S2,http://jurnal.stainponorogo.ac.id/index.php/cendekia/index
181,Ikonomika : Jurnal Ekonomi dan Bisnis Islam,S2,http://ejournal.radenintan.ac.id/index.php/ikonomika
182,Jurnal Kelautan Tropis,S2,https://ejournal2.undip.ac.id/index.php/jkt/index
183,Jurnal Kesehatan Lingkungan Indonesia,S2,https://ejournal.undip.ac.id/index.php/jkli/index
184,Psikohumaniora: Jurnal Penelitian Psikologi,S2,http://journal.walisongo.ac.id/index.php/Psikohumaniora/index
185,Jurnal Kebijakan Perikanan Indonesia,S2,http://ejournal-balitbang.kkp.go.id/index.php/jkpi/index
186,JURNAL BIOEDUKATIKA,S2,http://journal.uad.ac.id/index.php/BIOEDUKATIKA/
187,Jurnal Komunikasi ASPIKOM,S2,http://jurnalaspikom.org/index.php/aspikom
188,Jurnal Kawistara Jurnal Ilmu Sosial dan Humaniora,S2,http://jurnal.ugm.ac.id/kawistara
189,Journal of Educational Science and Technology,S2,http://ojs.unm.ac.id/index.php/JEST/index
190,Jurnal Akuntansi Multiparadigma,S2,http://jamal.ub.ac.id/index.php/jamal
191,Jurnal Iktiologi Indonesia,S2,http://jurnal-iktiologi.org/index.php/jii
192,Beta : Jurnal Tadris Matematika,S2,http://jurnalbeta.ac.id/index.php/betaJTM
193,JEPIN (Jurnal Edukasi dan Penelitian Informatika),S2,http://jurnal.untan.ac.id/index.php/jepin/index
194,Jurnal Penelitian Komunikasi dan Opini Publik,S2,https://jurnal.kominfo.go.id/index.php/jpkop/index
195,Jurnal Ilmiah Kebijakan Hukum,S2,http://ejournal.balitbangham.go.id/index.php/kebijakan
196,Edukasi: Jurnal Penelitian Pendidikan dan Keagamaan,S2,http://www.jurnaledukasikemenag.org/index.php/edukasi
197,JURNAL KAJIAN AKUNTANSI,S2,http://jurnal.unswagati.ac.id/index.php/jka
198,Jurnal Inovasi Pendidikan IPA,S2,https://journal.uny.ac.id/index.php/jipi
199,ASSETS: Jurnal Akuntansi dan Pendidikan,S2,http://e-journal.unipma.ac.id/index.php/assets
200,The Journal of Pure and Applied Chemistry Research,S2,http://jpacr.ub.ac.id/
201,Jurnal Komunikasi Indonesia,S2,http://journal.ui.ac.id/jkmi
202,"LIMNOTEK, Perairan Darat Tropis di Indonesia",S2,http://limnotek.or.id/index.php/limnotek
203,Jurnal Manajemen dan Pemasaran Jasa,S2,http://www.trijurnal.lemlit.trisakti.ac.id/index.php/jasa
204,Jurnal Pendidikan Fisika Indonesia,S2,https://journal.unnes.ac.id/nju/index.php/JPFI
205,Jurnal Penelitian dan Pembelajaran IPA,S2,http://jurnal.untirta.ac.id/index.php/JPPI/index
206,"Jurnal Pendidikan : Teori, Penelitian, dan Pengembangan",S2,http://journal.um.ac.id/index.php/jptpp/index
207,CommIT (Communication and Information Technology) Journal,S2,https://journal.binus.ac.id/index.php/commit/index
208,Jurnal Riset Akuakultur,S2,http://ejournal-balitbang.kkp.go.id/index.php/jra
209,JEES (Journal of English Educators Society),S2,http://ojs.umsida.ac.id/index.php/jees
210,Kertha Patrika,S2,https://ojs.unud.ac.id/index.php/kerthapatrika
211,Agritech,S2,https://jurnal.ugm.ac.id/agritech/
212,Jurnal Pendidikan Vokasi,S2,http://journal.uny.ac.id/index.php/jpv
213,Aksara,S2,http://aksara.kemdikbud.go.id/jurnal/index.php/aksara/index
214,Lontar Komputer : Jurnal Ilmiah Teknologi Informasi ,S2,https://ojs.unud.ac.id/index.php/lontar
215,Indonesian Journal of Cancer Chemoprevention,S2,https://ijcc.chemoprev.org/index.php/ijcc
216,English Review: Journal of English Education,S2,https://journal.uniku.ac.id/index.php/ERJEE/index
217,Eralingua : Jurnal Pendidikan Bahasa Asing dan Sastra,S2,https://ojs.unm.ac.id/eralingua/index
218,Jurnal Teknik Elektro,S2,https://journal.unnes.ac.id/nju/index.php/jte/index
219,Jurnal Ekonomi dan Bisnis,S2,http://ejournal.uksw.edu/jeb
220,Jurnal Obsesi: Jurnal Pendidikan Anak Usia Dini,S2,http://journal.universitaspahlawan.ac.id/index.php/obsesi
221,Jurnal Ilmu-Ilmu Peternakan (Indonesian Journal of Animal Science),S2,http://jiip.ub.ac.id/index.php/jiip/issue/archive
222,Jurnal Akuntansi,S2,http://ecojoin.org/index.php/EJA
223,Jurnal Tanah dan Iklim,S2,http://ejurnal.litbang.pertanian.go.id/index.php/jti
224,Makara Journal of Science,S2,http://journal.ui.ac.id/index.php/science
225,Economics Development Analysis Journal,S2,https://journal.unnes.ac.id/sju/index.php/edaj/index
226,Jurnal Sylva Lestari,S2,http://jurnal.fp.unila.ac.id/index.php/JHT/index
227,Oseanologi dan Limnologi di Indonesia,S2,http://jurnal-oldi.or.id/index.php/oldi
228,Jurnal Administrasi Kesehatan Indonesia,S2,https://e-journal.unair.ac.id/index.php/JAKI
229,"Journal of Mechatronics, Electrical Power, and Vehicular Technology",S2,http://www.mevjournal.com
230,Sawwa: Jurnal Studi Gender dan Anak,S2,http://journal.walisongo.ac.id/index.php/sawwa
231,The Indonesian Accounting Review,S2,https://journal.perbanas.ac.id/index.php/tiar
232,Episteme : Jurnal Pengembangan Ilmu Keislaman,S2,http://ejournal.iain-tulungagung.ac.id/index.php/epis
233,Indonesian Fisheries Research Journal,S2,http://ejournal-balitbang.kkp.go.id/index.php/ifrj
234,"Journal of Accounting, Business and Management (JABM)",S2,http://journal.stie-mce.ac.id/index.php/jabminternational
235,Jurnal Penelitian Kelapa Sawit,S2,http://jurnalkelapasawit.iopri.org/index.php/jpks
236,Jurnal Irigasi,S2,http://jurnalirigasi_pusair.pu.go.id/index.php/jurnal_irigasi
237,Media Komunikasi Teknik Sipil,S2,http://ejournal.undip.ac.id/index.php/mkts
238,DUNAMIS: Jurnal Teologi dan Pendidikan Kristiani,S2,http://www.sttintheos.ac.id/e-journal/index.php/dunamis
239,Al-Uqud: Journal of Islamic Economic,S2,https://journal.unesa.ac.id/index.php/jie
240,Global Strategis,S2,http://e-journal.unair.ac.id/index.php/JGS
241,Islamic Guidance and Counseling Journal,S2,https://journal.iaimnumetrolampung.ac.id/index.php/igcj
242,Jurnal Keuangan dan Perbankan,S2,http://jurnal.unmer.ac.id/index.php/jkdp
243,Journal of Aquaculture and Fish Health,S2,https://e-journal.unair.ac.id/JAFH
244,Jurnal Komunikasi Ikatan Sarjana Komunikasi Indonesia,S2,http://jurnal-iski.or.id/index.php/jkiski/index
245,Pelita Perkebunan,S2,http://www.ccrjournal.com/index.php/ccrj
246,"Journal of Economics, Business, & Accountancy Ventura",S2,https://journal.perbanas.ac.id/index.php/jebav
247,Amerta Nutrition,S2,https://e-journal.unair.ac.id/AMNT
248,"Media Riset Akuntansi, Auditing & Informasi",S2,http://www.trijurnal.lemlit.trisakti.ac.id/index.php/mraai/index
249,COUNS-EDU: The International Journal of Counseling and Education,S2,http://journal.konselor.or.id/index.php/counsedu
250,EMITTER : International Journal of Engineering Technology,S2,https://emitter.pens.ac.id/index.php/emitter/index
251,Wartazoa : Buletin Ilmu Peternakan dan Kesehatan Hewan Indonesia,S2,http://medpub.litbang.pertanian.go.id/index.php/wartazoa
252,Jurnal Tamanan Industri dan Penyegar (Journal of Industrial and Beverage Crops),S2,http://ejurnal.litbang.pertanian.go.id/index.php/bultri/
253,International Journal of Artificial Intelligence Research,S2,http://ijair.id/index.php/ijair/index
254,Jurnal Litbang Industri,S2,http://ejournal.kemenperin.go.id/jli
255,Berkala Ilmu Perpustakaan dan Informasi ,S2,https://jurnal.ugm.ac.id/bip
256,"RETORIKA: Jurnal Bahasa, Sastra, dan Pengajarannya",S2,http://ojs.unm.ac.id/retorika
257,Mix : Jurnal Ilmiah Manajemen,S2,http://publikasi.mercubuana.ac.id/index.php/Jurnal_Mix
258,JNTETI (Jurnal Nasional Teknik Elektro dan Teknologi Informasi),S2,http://ejnteti.jteti.ugm.ac.id/index.php/JNTETI/
259,"ELKOMIKA: Jurnal Teknik Energi Elektrik, Teknik Telekomunikasi, & Teknik Elektronika",S2,http://ejurnal.itenas.ac.id/index.php/elkomika
260,Jurnal Teknologi Reaktor Nuklir Tri Dasa Mega,S2,http://jurnal.batan.go.id/index.php/tridam/index
261,Journal on English as a Foreign Language (JEFL),S2,http://e-journal.iain-palangkaraya.ac.id/index.php/jefl/index
262,Buletin Ilmiah Marina : Sosial Ekonomi Kelautan dan Perikanan,S2,http://ejournal-balitbang.kkp.go.id/index.php/mra
263,Indonesian Journal of Clinical Pathology and Medical Laboratory (IJCPML),S2,http://www.indonesianjournalofclinicalpathology.or.id/index.php/patologi
264,Forum Geografi,S2,http://journals.ums.ac.id/index.php/fg/issue/archive
265,Jurnal Penelitian Politik,S2,http://ejournal.politik.lipi.go.id/index.php/jpp
266,Buletin Peternakan,S2,http://buletinpeternakan.fapet.ugm.ac.id
267,Mimbar : Jurnal Sosial dan Pembangunan,S2,https://ejournal.unisba.ac.id/index.php/mimbar
268,JKAP (Jurnal Kebijakan dan Administrasi Publik),S2,https://journal.ugm.ac.id/jkap
269,Studies in English Language and Education,S2,http://www.jurnal.unsyiah.ac.id/SiELE
270,Jurnal Psikologi,S2,http://jurnal.ugm.ac.id/jpsi
271,JDM (Jurnal Dinamika Manajemen),S2,https://journal.unnes.ac.id/nju/index.php/jdm/index
272,Journal of Government and Civil Society,S2,http://jurnal.umt.ac.id/index.php/jgs
273,Jurnal SPORTIF,S2,http://ojs.unpkediri.ac.id/index.php/pjk
274,INTERMESTIC: Journal of International Studies,S2,http://intermesticjournal.fisip.unpad.ac.id/index.php/intermestic
275,Varia Justicia,S2,http://journal.ummgl.ac.id/index.php/variajusticia/
276,Islamica: Jurnal Studi Keislaman,S2,http://islamica.uinsby.ac.id/index.php/islamica/index
277,Jurnal Tadris Kimiya,S2,http://journal.uinsgd.ac.id/index.php/tadris-kimiya/index
278,Al Ibtida: Jurnal Pendidikan Guru MI,S2,http://www.syekhnurjati.ac.id/jurnal/index.php/ibtida
279,Jurnal Pendidikan Islam,S2,http://journal.uinsgd.ac.id/index.php/jpi/index
280,"EduLite: Journal of English Education, Literature and Culture",S2,http://jurnal.unissula.ac.id/index.php/edulite/index
281,Shirkah Journal of Economics and Business,S2,http://shirkah.or.id/new-ojs/index.php/home
282,Jurnal Vektor Penyakit ,S2,http://ejournal.litbang.depkes.go.id/index.php/vektorp
283,Journal of Accounting and Investment,S2,http://journal.umy.ac.id/index.php/ai/index
284,KAPAL: Jurnal Ilmu Pengetahuan dan Teknologi Kelautan,S2,https://ejournal.undip.ac.id/index.php/kapal
285,Buloma (Buletin Oseanografi Marina),S2,https://ejournal.undip.ac.id/index.php/buloma
