journal_name,journal_url,journal_accreditation
"Indonesian Journal of Electrical Engineering and Computer Science","http://ijeecs.iaescore.com/index.php/IJEECS","S1 Accredited"
"MAKARA of Science Series","http://journal.ui.ac.id/index.php/science","S1 Accredited"
"Gadjah Mada International Journal of Business (GamaIJB)","https://jurnal.ugm.ac.id/gamaijb","S1 Accredited"
"Bestuur","https://jurnal.uns.ac.id/bestuur/index","S1 Accredited"
"Jurnal Cakrawala Pendidikan","http://journal.uny.ac.id/index.php/cp","S1 Accredited"
"Indonesian Journal of Science and Technology","http://ejournal.upi.edu/index.php/ijost/","S1 Accredited"
"QIJIS (Qudus International Journal Of Islamic Studies)","http://journal.stainkudus.ac.id/index.php/QIJIS","S1 Accredited"
"Operations and Supply Chain Management: An International Journal","http://journal.oscm-forum.org/","S1 Accredited"
"International Journal of Evaluation and Research in Education (IJERE)","http://ijere.iaescore.com/index.php/IJERE","S1 Accredited"
"Journal of Robotics and Control (JRC)","http://journal.umy.ac.id/index.php/jrc","S1 Accredited"
"Journal of ICT Research and Applications","https://journals.itb.ac.id/index.php/jictra","S1 Accredited"
"Al-Jami'ah: Journal of Islamic Studies","http://www.aljamiah.or.id","S1 Accredited"
"International Journal of Renewable Energy Development : JRED","http://ejournal.undip.ac.id/index.php/ijred/index","S1 Accredited"
"Bali Medical Journal","http://www.balimedicaljournal.id","S1 Accredited"
"Sriwijaya Law Review","http://journal.fh.unsri.ac.id/index.php/sriwijayalawreview/index","S1 Accredited"
"Jurnal Ilmiah Islam Futura","https://jurnal.ar-raniry.ac.id/index.php/islamfutura","S1 Accredited"
"Journal of Indonesian Legal Studies","https://journal.unnes.ac.id/sju/index.php/jils","S1 Accredited"
"Geoplanning: Journal of Geomatics and Planning","http://ejournal.undip.ac.id/index.php/geoplanning/","S1 Accredited"
"Ahkam: Jurnal Ilmu Syariah","http://journal.uinjkt.ac.id/index.php/ahkam","S1 Accredited"
"JURIS (Jurnal Ilmiah Syariah)","http://ecampus.iainbatusangkar.ac.id/ojs/index.php/Juris","S1 Accredited"
"Journal of Southeast Asian Human Rights","https://jurnal.unej.ac.id/index.php/JSEAHR","S1 Accredited"
"Indonesian Journal of Islam and Muslim Societies","http://ijims.iainsalatiga.ac.id","S1 Accredited"
"Science and Technology Indonesia","http://sciencetechindonesia.com/index.php/jsti","S1 Accredited"
"Belitung Nursing Journal","http://belitungraya.org/BRP/index.php/bnj","S1 Accredited"
"Islamic Guidance and Counseling Journal","https://journal.iaimnumetrolampung.ac.id/index.php/igcj","S1 Accredited"
"Psikohumaniora: Jurnal Penelitian Psikologi","https://journal.walisongo.ac.id/index.php/Psikohumaniora","S1 Accredited"
"Jurnal Ilmu Ternak dan Veteriner","http://medpub.litbang.pertanian.go.id/index.php/jitv","S1 Accredited"
"TELKOMNIKA (Telecommunication Computing Electronics and Control)","http://journal.uad.ac.id/index.php/telkomnika","S1 Accredited"
"Journal of Indonesian Islam","http://jiis.uinsby.ac.id/index.php/JIIs/index","S1 Accredited"
"SAMARAH : Jurnal Hukum Keluarga dan Hukum Islam","https://jurnal.ar-raniry.ac.id/index.php/samarah","S1 Accredited"
"Biodiversitas : Journal of Biological Diversity","http://biodiversitas.mipa.uns.ac.id/","S1 Accredited"
"Buletin Ekonomi Moneter dan Perbankan","https://www.bmeb-bi.org/index.php/BEMP/","S1 Accredited"
"ETIKONOMI","http://journal.uinjkt.ac.id/index.php/etikonomi","S1 Accredited"
"Forest and Society","http://journal.unhas.ac.id/index.php/fs/index","S1 Accredited"
"Indonesian Journal of Forestry Research","http://ejournal.forda-mof.org/ejournal-litbang/index.php/IJFR","S1 Accredited"
"JOIV : International Journal on Informatics Visualization","http://joiv.org/","S1 Accredited"
"Journal of Islamic Monetary Economics and Finance","http://www.jimf-bi.org/index.php/JIMF","S1 Accredited"
"Bulletin of Electrical Engineering and Informatics","http://journal.portalgaruda.org/index.php/EEI","S1 Accredited"
"IJAIN (International Journal of Advances in Intelligent Informatics)","http://ijain.org/index.php/IJAIN","S1 Accredited"
"Lex Scientia Law Review","https://journal.unnes.ac.id/sju/index.php/lslr/issue/archive","S1 Accredited"
"AGRARIS: Journal of Agribusiness and Rural Development Research","http://journal.umy.ac.id/index.php/ag","S1 Accredited"
"Journal on Mathematics Education","http://ejournal.unsri.ac.id/index.php/jme","S1 Accredited"
"SAINS TANAH - Journal of Soil Science and Agroclimatology","https://jurnal.uns.ac.id/tanah","S1 Accredited"
"Jurnal Keperawatan Soedirman (The Soedirman Journal of Nursing)","http://jks.fikes.unsoed.ac.id/index.php/jks/issue/archive","S1 Accredited"
"Jurnal Ilmu Sosial dan Ilmu Politik","http://jurnal.ugm.ac.id/jsp","S1 Accredited"
"Studia Islamika","http://journal.uinjkt.ac.id/index.php/studia-islamika","S1 Accredited"
"International Journal of Reconfigurable and Embedded Systems (IJRES)","http://ijres.iaescore.com/index.php/IJRES","S1 Accredited"
"International Journal of Power Electronics and Drive Systems","http://ijpeds.iaescore.com/index.php/IJPEDS","S1 Accredited"
"International Journal of Electrical and Computer Engineering","http://ijece.iaescore.com/index.php/IJECE","S1 Accredited"
"International Journal on Advanced Science, Engineering and Information Technology (IJASEIT)","http://ijaseit.insightsociety.org/","S1 Accredited"
"Al-Ihkam: Jurnal Hukum dan Pranata Sosial","http://ejournal.iainmadura.ac.id/index.php/alihkam/index","S1 Accredited"
"Studies in English Language and Education","http://www.jurnal.unsyiah.ac.id/SiELE","S1 Accredited"
"Journal of Degraded and Mining Lands Management","http://jdmlm.ub.ac.id/index.php/jdmlm/index","S1 Accredited"
"Register: Jurnal Ilmiah Teknologi Sistem Informasi","http://www.journal.unipdu.ac.id/index.php/register/index","S1 Accredited"
"Electronic Journal of Graph Theory and Applications","http://www.ejgta.org/index.php/ejgta/index","S1 Accredited"
"Automotive Experiences","http://journal.unimma.ac.id/index.php/AutomotiveExperiences","S1 Accredited"
"Bulletin of Chemical Reaction Engineering & Catalysis","https://ejournal2.undip.ac.id/index.php/bcrec","S1 Accredited"
"IAES International Journal of Artificial Intelligence","http://ijai.iaescore.com/index.php/IJAI","S1 Accredited"
"CommIT (Communication and Information Technology) Journal","https://journal.binus.ac.id/index.php/commit/index","S1 Accredited"
"Hasanuddin Law Review","http://pasca.unhas.ac.id/ojs/index.php/halrev","S1 Accredited"
"Journal of Mathematical and Fundamental Sciences","https://journals.itb.ac.id/index.php/jmfs","S1 Accredited"
"PADJADJARAN Jurnal Ilmu Hukum (Journal of Law)","http://jurnal.unpad.ac.id/pjih/index","S1 Accredited"
"Interiority","https://interiority.eng.ui.ac.id/index.php/journal","S1 Accredited"
"Nurse Media Journal of Nursing","https://ejournal.undip.ac.id/index.php/medianers/index","S1 Accredited"
"Tropical Animal Science Journal","http://journal.ipb.ac.id/index.php/mediapeternakan","S1 Accredited"
"Indonesian Journal of Chemistry","https://journal.ugm.ac.id/index.php/ijc","S1 Accredited"
"Canrea Journal: Food Technology, Nutritions, and Culinary Journal","http://agritech.unhas.ac.id/ojs/index.php/canrea/index","S1 Accredited"
"Communications in Science and Technology","https://cst.kipmi.or.id","S1 Accredited"
"Jurnal Kesehatan Masyarakat","https://journal.unnes.ac.id/nju/index.php/kemas","S1 Accredited"
"ILMU KELAUTAN: Indonesian Journal of Marine Sciences","http://ejournal.undip.ac.id/index.php/ijms/index","S1 Accredited"
"Paediatrica Indonesiana","https://paediatricaindonesiana.org/","S1 Accredited"
"IJOG : Indonesian Journal on Geoscience","https://ijog.geologi.esdm.go.id/index.php/IJOG","S1 Accredited"
"Journal of Islamic Architecture","http://ejournal.uin-malang.ac.id/index.php/JIA","S1 Accredited"
"Journal of Tropical Life Science : International Journal of Theoretical, Experimental, and Applied Life Sciences","http://jtrolis.ub.ac.id/index.php/jtrolis/index","S1 Accredited"
"Wacana, Journal of the Humanities of Indonesia","http://wacana.ui.ac.id","S1 Accredited"
"Universa Medicina","https://univmed.org/ejurnal/index.php/medicina/index","S1 Accredited"
"Microbiology Indonesia","https://jurnal.permi.or.id/index.php/mionline","S1 Accredited"
"Kesmas: Jurnal Kesehatan Masyarakat Nasional","http://journal.fkm.ui.ac.id/index.php/kesmas","S1 Accredited"
"Indonesian Journal of International Law","https://scholarhub.ui.ac.id/ijil","S1 Accredited"
"Jurnal Keperawatan Indonesia","http://jki.ui.ac.id/index.php/jki","S1 Accredited"
"Indonesian Journal of Applied Linguistics (IJAL)","http://ejournal.upi.edu/index.php/IJAL","S1 Accredited"
"Indonesian Journal of Electical Engineering and Informatics (IJEEI)","http://section.iaesonline.com/index.php/IJEEI/index","S1 Accredited"
"Teosofi: Jurnal Tasawuf dan Pemikiran Islam","http://jurnalfuf.uinsby.ac.id/index.php/teosofi","S1 Accredited"
"INDONESIAN JOURNAL OF APPLIED PHYSICS","https://jurnal.uns.ac.id/ijap","S1 Accredited"
"Dental Journal (Majalah Kedokteran Gigi)","https://e-journal.unair.ac.id/MKG/index","S1 Accredited"
"Paramita: Historical Studies Journal","http://journal.unnes.ac.id/nju/index.php/paramita","S1 Accredited"
"Medical Journal of Indonesia","http://mji.ui.ac.id/journal/index.php/mji","S1 Accredited"
"Indonesian Journal of Geography","http://jurnal.ugm.ac.id/ijg/","S1 Accredited"
"Jurnal Pendidikan IPA Indonesia (Indonesian Journal of Science Education)","http://journal.unnes.ac.id/nju/index.php/jpii","S1 Accredited"
"TEFLIN Journal","http://www.journal.teflin.org","S1 Accredited"
"Journal of the Indonesian Tropical Animal Agriculture","https://ejournal.undip.ac.id/index.php/jitaa/index","S1 Accredited"
"AGRIVITA, Journal of Agricultural Science (AJAS)","https://agrivita.ub.ac.id/index.php/agrivita","S1 Accredited"
"Critical Care and Shock","http://criticalcareshock.org/","S1 Accredited"
"International Journal on Electrical Engineering and Informatics","http://www.ijeei.org/","S1 Accredited"
"International Journal of Technology","https://ijtech.eng.ui.ac.id","S1 Accredited"
"Kukila","http://kukila.org/index.php/KKL","S1 Accredited"
"Indonesian Journal of Biotechnology","https://jurnal.ugm.ac.id/ijbiotech/","S1 Accredited"
"Harmonia: Journal of Arts Research and Education","http://journal.unnes.ac.id/nju/index.php/harmonia","S1 Accredited"
"Molekul: Jurnal Ilmiah Kimia","https://ojs.jmolekul.com/ojs/index.php/jm/index","S1 Accredited"
"Journal of Regional and City Planning","http://journals.itb.ac.id/index.php/jpwk","S1 Accredited"
"Journal of Engineering and Technological Sciences","https://journals.itb.ac.id/index.php/jets/index","S1 Accredited"
"Atom Indonesia","http://aij.batan.go.id/","S1 Accredited"
"The Indonesian Biomedical Journal","http://inabj.org/index.php/ibj","S1 Accredited"
"Journal of Mechatronics, Electrical Power, and Vehicular Technology","http://www.mevjournal.com","S1 Accredited"
"Indonesian Aquaculture Journal","http://ejournal-balitbang.kkp.go.id/index.php/iaj/index","S1 Accredited"
"Civil Engineering Dimension","http://ced.petra.ac.id","S1 Accredited"
"Mazahib Jurnal Pemikiran Hukum Islam","https://journal.uinsi.ac.id/index.php/mazahib","S1 Accredited"
"Indonesian Journal of Pharmacy","http://indonesianjpharm.farmasi.ugm.ac.id/index.php/3","S1 Accredited"
"Indonesian Journal of Agricultural Science","http://ejurnal.litbang.pertanian.go.id/index.php/ijas","S1 Accredited"
"BIOTROPIA","http://journal.biotrop.org/index.php/biotropia","S1 Accredited"
"Jurnal Ilmiah Perikanan dan Kelautan","https://e-journal.unair.ac.id/index.php/JIPK","S1 Accredited"
"Makara Journal of Health Research","https://scholarhub.ui.ac.id/mjhr/","S1 Accredited"
"HAYATI Journal of Biosciences","http://journal.ipb.ac.id/index.php/hayati/","S1 Accredited"
"Caraka Tani: Journal of Sustainable Agriculture","https://jurnal.uns.ac.id/index.php/carakatani","S1 Accredited"
"Jurnal Manajemen Hutan Tropika","http://journal.ipb.ac.id/index.php/jmht/","S1 Accredited"
"ACTA MEDICA INDONESIANA","http://www.actamedindones.org/index.php/ijim","S1 Accredited"
"Ijtihad : Jurnal Wacana Hukum Islam dan Kemanusiaan","http://ijtihad.iainsalatiga.ac.id","S1 Accredited"
"Jurnal NERS","https://e-journal.unair.ac.id/index.php/JNERS","S1 Accredited"
"Economic Journal of Emerging Markets","http://journal.uii.ac.id/index.php/JEP/index","S1 Accredited"
"Brawijaya Law Journal : Journal of Legal Studies","http://lawjournal.ub.ac.id/index.php/law/index","S1 Accredited"
"REINWARDTIA","http://e-journal.biologi.lipi.go.id/index.php/reinwardtia/index","S1 Accredited"
"ASEAN Journal on Science and Tecnology for Development","http://ajstd.org/index.php/ajstd/index","S1 Accredited"
"Bali Journal of Anesthesiology","http://www.bjoaonline.com/","S1 Accredited"
"JAS (Journal of ASEAN Studies)","https://journal.binus.ac.id/index.php/jas/index","S1 Accredited"
"Scientific Contributions Oil and Gas","https://journal.lemigas.esdm.go.id/index.php/SCOG","S1 Accredited"
"Squalen Bulletin of Marine and Fisheries Postharvest and Biotechnology","http://www.bbp4b.litbang.kkp.go.id/squalen-bulletin/index.php/squalen","S1 Accredited"
"International Journal of Public Health Science","http://ijphs.iaescore.com/index.php/IJPHS","S1 Accredited"
"Journal of the Indonesian Mathematical Society","https://jims-a.org","S1 Accredited"
"IJoLE: International Journal of Language Education","http://ojs.unm.ac.id/index.php/ijole","S1 Accredited"
"Journal of Tropical Biodiversity and Biotechnology","https://jurnal.ugm.ac.id/jtbb","S1 Accredited"
"Journal of Innovation in Educational and Cultural Research","http://jiecr.org/index.php/jiecr","S2 Accredited"
"Mosharafa: Jurnal Pendidikan Matematika","https://journal.institutpendidikan.ac.id/index.php/mosharafa","S2 Accredited"
"Jurnal Veteriner : Jurnal Kedokteran Hewan Indonesia","http://ojs.unud.ac.id/index.php/jvet","S2 Accredited"
"Jurnal Psikologi Sosial","http://jps.ui.ac.id/index.php/jps","S2 Accredited"
"Journal The Winners : Economics, Business, Management, and Information System Journal","https://journal.binus.ac.id/index.php/winners","S2 Accredited"
"Jurnal Pendidikan Sains Indonesia (Indonesian Journal of Science Education)","http://jurnal.unsyiah.ac.id/JPSI","S2 Accredited"
"Indonesian Journal on Learning and Advanced Education (IJOLAE)","http://journals.ums.ac.id/index.php/ijolae","S2 Accredited"
"Journal of Education Technology","https://ejournal.undiksha.ac.id/index.php/JET/index","S2 Accredited"
"Jurnal Geologi dan Sumberdaya Mineral","http://jgsm.geologi.esdm.go.id/index.php/JGSM","S2 Accredited"
"Journal of Leadership in Organization","https://jurnal.ugm.ac.id/leadership","S2 Accredited"
"Indonesian Journal of Geography","https://jurnal.ugm.ac.id/ijg","S1 Accredited"
"Saintek Perikanan : Indonesian Journal of Fisheries Science and Technology","https://ejournal.undip.ac.id/index.php/saintek","S2 Accredited"
"Jurnal Teknologi dan Sistem Komputer","https://jtsiskom.undip.ac.id/index.php/jtsiskom/index","S2 Accredited"
"International Journal of Social Science and Business","https://ejournal.undiksha.ac.id/index.php/IJSSB","S2 Accredited"
"Media Gizi Indonesia","https://e-journal.unair.ac.id/MGI","S2 Accredited"
"Jurnal Legislasi Indonesia","http://e-jurnal.peraturan.go.id/index.php/jli/index","S2 Accredited"
"Jurnal Rechts Vinding : Media Pembinaan Hukum Nasional","http://www.rechtsvinding.bphn.go.id/ejournal/index.php/jrv","S2 Accredited"
"Journal of Information Systems Engineering and Business Intelligence","http://e-journal.unair.ac.id/index.php/JISEBI/issue/archive","S2 Accredited"
"Iqtishadia: Jurnal Kajian Ekonomi dan Bisnis Islam","http://journal.stainkudus.ac.id/index.php/IQTISHADIA","S2 Accredited"
"Journal of Governance and Public Policy","http://journal.umy.ac.id/index.php/gpp","S2 Accredited"
"Jurnal Ekonomi dan Keuangan Islam","https://journal.uii.ac.id/JEKI","S2 Accredited"
"Jurnal Iqra' : Kajian Ilmu Pendidikan","http://journal.iaimnumetrolampung.ac.id/index.php/ji/","S2 Accredited"
"IJEE (Indonesian Journal of English Education)","http://journal.uinjkt.ac.id/index.php/ijee","S2 Accredited"
"Nyimak: Journal of Communication","http://jurnal.umt.ac.id/index.php/nyimak/index","S2 Accredited"
"Jurnal Teknologi Informasi dan Ilmu Komputer","http://jtiik.ub.ac.id","S2 Accredited"
"Wawasan : Jurnal Ilmiah Agama dan Sosial Budaya","http://journal.uinsgd.ac.id/index.php/jw","S2 Accredited"
"International Journal of Education","http://ejournal.upi.edu/index.php/ije","S2 Accredited"
"Share: Jurnal Ekonomi dan Keuangan Islam","https://jurnal.ar-raniry.ac.id/index.php/Share","S2 Accredited"
"Jurnal Manajemen dan Kewirausahaan","http://jurnalmanajemen.petra.ac.id/","S2 Accredited"
"IJCCS (Indonesian Journal of Computing and Cybernetics Systems)","https://jurnal.ugm.ac.id/ijccs","S2 Accredited"
"JPP Undiksha","https://ejournal.undiksha.ac.id/index.php/JPP","S2 Accredited"
"Journal of Education and Learning (EduLearn)","http://edulearn.intelektual.org","S2 Accredited"
"Jurnal Obsesi: Jurnal Pendidikan Anak Usia Dini","https://obsesi.or.id/index.php/obsesi","S2 Accredited"
"Jurnal Dakwah Risalah","http://ejournal.uin-suska.ac.id/index.php/risalah","S2 Accredited"
"Yuridika","https://e-journal.unair.ac.id/YDK","S2 Accredited"
"Jurnal Penelitian Hukum De Jure","http://ejournal.balitbangham.go.id/index.php/dejure","S2 Accredited"
"ASEAN Marketing Journal (AMJ)","https://scholarhub.ui.ac.id/amj/","S2 Accredited"
"Jurnal Politik","https://scholarhub.ui.ac.id/politik","S2 Accredited"
"International Journal of Islamic Economics and Finance (IJIEF)","http://journal.umy.ac.id/index.php/ijief","S2 Accredited"
"JURNAL PEMBANGUNAN HUKUM INDONESIA","https://ejournal2.undip.ac.id/index.php/jphi","S2 Accredited"
"Jurnal FIlsafat","https://jurnal.ugm.ac.id/wisdom/index","S2 Accredited"
"Jurnal Prima Edukasia","http://journal.uny.ac.id/index.php/jpe","S2 Accredited"
"Jurnal ASPIKOM","http://jurnalaspikom.org/index.php/aspikom","S2 Accredited"
"JURNAL HAMA DAN PENYAKIT TUMBUHAN TROPIKA","http://jhpttropika.fp.unila.ac.id/index.php/jhpttropika","S2 Accredited"
"Jurnal HAM","http://ejournal.balitbangham.go.id/index.php/ham","S2 Accredited"
"Jurnal Elemen Program Studi Pendidikan Matematika STKIP Hamzanwadi Selong","http://e-journal.hamzanwadi.ac.id/index.php/jel","S2 Accredited"
"Jurnal Pendidikan Matematika","http://ejournal.unsri.ac.id/index.php/jpm","S2 Accredited"
"AL-TANZIM : JURNAL MANAJEMEN PENDIDIKAN ISLAM","https://ejournal.unuja.ac.id/index.php/al-tanzim/issue/archive","S2 Accredited"
"Psychological Research on Urban Society","https://scholarhub.ui.ac.id/proust","S2 Accredited"
"International Journal of Artificial Intelligence Research","http://ijair.id/index.php/ijair","S2 Accredited"
"QALAMUNA: Jurnal Pendidikan, Sosial, dan Agama","https://ejournal.insuriponorogo.ac.id/index.php/qalamuna","S2 Accredited"
"Jurnal Ekonomi dan Bisnis","http://ejournal.uksw.edu/jeb","S2 Accredited"
"Journal Sport Area","http://journal.uir.ac.id/index.php/JSP/issue/view/48","S2 Accredited"
"Jurnal Sejarah Citra Lekha","http://ejournal.undip.ac.id/index.php/jscl/index","S2 Accredited"
"Jurnal PEKOMMAS","https://jurnal.kominfo.go.id/index.php/pekommas/index","S2 Accredited"
"Jurnal Studi Komunikasi dan Media","https://jurnal.kominfo.go.id/index.php/jskm","S2 Accredited"
"JEMA: Jurnal Ilmiah Bidang Akuntansi dan Manajemen","http://riset.unisma.ac.id/index.php/jema/issue/archive","S2 Accredited"
"JPPPF (Jurnal Penelitian dan Pengembangan Pendidikan Fisika)","http://journal.unj.ac.id/unj/index.php/jpppf","S2 Accredited"
"Accounting Analysis Journal","https://journal.unnes.ac.id/sju/index.php/aaj","S2 Accredited"
"Jurnal Ilmiah Kebijakan Hukum","http://ejournal.balitbangham.go.id/index.php/kebijakan/issue/archive","S2 Accredited"
"JOIN (Jurnal Online Informatika)","http://join.if.uinsgd.ac.id/index.php/join","S2 Accredited"
"Jurnal Ilmu Sosial dan Humaniora","http://ejournal.undiksha.ac.id/index.php/JISH/","S2 Accredited"
"Al-Tadzkiyyah: Jurnal Pendidikan Islam","http://ejournal.radenintan.ac.id/index.php/tadzkiyyah/issue/archive","S2 Accredited"
"Jurnal Pendidikan Geografi: Kajian, Teori, dan Praktik dalam Bidang Pendidikan dan Ilmu Geografi","http://journal2.um.ac.id/index.php/jpg","S2 Accredited"
"Jurnal Kependidikan: Jurnal Hasil Penelitian dan Kajian Kepustakaan di Bidang Pendidikan, Pengajaran, dan Pembelajaran","https://e-journal.undikma.ac.id/index.php/jurnalkependidikan/index","S2 Accredited"
"Journal of Educational Science and Technology","http://ojs.unm.ac.id/index.php/JEST/index","S2 Accredited"
"JEES (Journal of English Educators Society)","http://ojs.umsida.ac.id/index.php/jees","S2 Accredited"
"MIMBAR : Jurnal Sosial dan Pembangunan","https://ejournal.unisba.ac.id/index.php/mimbar/issue/archive","S2 Accredited"
"Jurnal Minds: Manajemen Ide dan Inspirasi","http://journal.uin-alauddin.ac.id/index.php/minds","S2 Accredited"
"JEPIN (Jurnal Edukasi dan Penelitian Informatika)","http://jurnal.untan.ac.id/index.php/jepin/index","S2 Accredited"
"Izdihar : Journal of Arabic Language Teaching, Linguistics, and Literature","http://ejournal.umm.ac.id/index.php/izdihar","S2 Accredited"
"IBDA` : Jurnal Kajian Islam dan Budaya","http://ejournal.uinsaizu.ac.id/index.php/ibda","S2 Accredited"
"Jurnal Ekonomi dan Pembangunan Indonesia","https://scholarhub.ui.ac.id/jepi/","S2 Accredited"
"Jurnal Pendidikan : Teori, Penelitian, dan Pengembangan","http://journal.um.ac.id/index.php/jptpp/index","S2 Accredited"
"Jurnal Dinamika Akuntansi dan Bisnis","http://jurnal.unsyiah.ac.id/JDAB/index","S2 Accredited"
"Indonesian Treasury Review: Jurnal Perbendaharaan, Keuangan Negara, dan Kebijakan Publik","http://itrev.kemenkeu.go.id/index.php/ITRev","S2 Accredited"
"Eralingua : Jurnal Pendidikan Bahasa Asing dan Sastra","https://ojs.unm.ac.id/eralingua/index","S2 Accredited"
"Jurnal Pendidikan Usia Dini","http://journal.unj.ac.id/unj/index.php/jpud/","S2 Accredited"
"Al-Jabar: Jurnal Pendidikan Matematika","http://ejournal.radenintan.ac.id/index.php/al-jabar/issue/archive","S2 Accredited"
"Journal of Natural Science and Integration","http://ejournal.uin-suska.ac.id/index.php/JNSI/index","S2 Accredited"
"Dinamika Ilmu","https://journal.uinsi.ac.id/index.php/dinamika_ilmu","S2 Accredited"
"Aspirasi : Jurnal Masalah-masalah Sosial","http://jurnal.dpr.go.id/index.php/aspirasi","S2 Accredited"
"Jurnal Konseling dan Pendidikan","http://jurnal.konselingindonesia.com/index.php/jkp","S2 Accredited"
"DIJB (Diponegoro International Journal of Business)","https://ejournal2.undip.ac.id/index.php/ijb","S2 Accredited"
"Ziswaf : Jurnal Zakat dan Wakaf","http://journal.stainkudus.ac.id/index.php/Ziswaf","S2 Accredited"
"AKRUAL: Jurnal Akuntansi","https://journal.unesa.ac.id/index.php/aj/index","S2 Accredited"
"Lontar Komputer: Jurnal Ilmiah Teknologi Informasi","https://ojs.unud.ac.id/index.php/lontar","S2 Accredited"
"Computer Science and Information Technologies","http://iaesprime.com/index.php/csit","S2 Accredited"
"Indonesian Journal of English Language Teaching and Applied Linguistics","http://ijeltal.org/index.php/ijeltal/issue/archive","S2 Accredited"
"Indonesian Journal of Information System","https://ojs.uajy.ac.id/index.php/IJIS","S2 Accredited"
"Jurnal Ekonomi & Kebijakan Publik","http://jurnal.dpr.go.id/index.php/ekp","S2 Accredited"
"JINOP (Jurnal Inovasi Pembelajaran)","http://ejournal.umm.ac.id/index.php/jinop","S2 Accredited"
"Journal of Education Reseach and Evaluation","https://ejournal.undiksha.ac.id/index.php/JERE","S2 Accredited"
"Integritas: Jurnal Antikorupsi","https://jurnal.kpk.go.id/index.php/integritas/issue/archive","S2 Accredited"
"International Journal of Education and Learning","http://pubs2.ascee.org/index.php/ijele","S2 Accredited"
"JURNAL DINAMIKA HUKUM","http://dinamikahukum.fh.unsoed.ac.id/","S2 Accredited"
"JPBI (JURNAL PENDIDIKAN BIOLOGI INDONESIA)","http://ejournal.umm.ac.id/index.php/jpbi/index","S2 Accredited"
"Jurnal Riset Pendidikan Matematika","http://journal.uny.ac.id/index.php/jrpm","S2 Accredited"
"Jurnal Bina Praja","http://jurnal.kemendagri.go.id/index.php/jbp","S2 Accredited"
"Jurnal Penelitian Transportasi Darat","http://ojs.balitbanghub.dephub.go.id/index.php/jurnaldarat/index","S2 Accredited"
"Jurnal Siasat Bisnis","https://journal.uii.ac.id/JSB","S2 Accredited"
"ULUL ALBAB","http://ejournal.uin-malang.ac.id/index.php/ululalbab","S2 Accredited"
"Jurnal Pendidikan Teknologi dan Kejuruan","https://journal.uny.ac.id/index.php/jptk","S2 Accredited"
"Jurnal Teknik Industri","https://ejournal.umm.ac.id/index.php/industri","S2 Accredited"
"JOSSAE (Journal of Sport Science and Education)","https://journal.unesa.ac.id/index.php/jossae/index","S2 Accredited"
"Al-Tahrir: Jurnal Pemikiran Islam","https://jurnal.iainponorogo.ac.id/index.php/tahrir","S2 Accredited"
"JAM : Jurnal Aplikasi Manajemen","http://jurnaljam.ub.ac.id/index.php/jam","S2 Accredited"
"Jurnal Civics: Media Kajian Kewarganegaraan","https://journal.uny.ac.id/index.php/civics/index","S2 Accredited"
"Journal of Accounting and Investment","http://journal.umy.ac.id/index.php/ai/","S2 Accredited"
"Journal of Socioeconomics and Development","http://publishing-widyagama.ac.id/ejournal-v2/index.php/jsed/index","S2 Accredited"
"PRofesi Humas","http://jurnal.unpad.ac.id/profesi-humas/index","S2 Accredited"
"Jurnal Ilmiah Sekolah Dasar","https://ejournal.undiksha.ac.id/index.php/JISD","S2 Accredited"
"Jurnal Akuntansi dan Keuangan","https://jurnalakuntansi.petra.ac.id/index.php/aku","S2 Accredited"
"Nadwa : Jurnal Pendidikan Islam","http://journal.walisongo.ac.id/index.php/Nadwa","S2 Accredited"
"Jurnal Studi Komunikasi","https://ejournal.unitomo.ac.id/index.php/jsk","S2 Accredited"
