journal_name,journal_url,journal_accreditation
"Jurnal Riset Ekonomi dan Bisnis","http://journals.usm.ac.id/index.php/jreb","S4 Accredited"
"INFORMATIKA : JURNAL INFORMATIKA, MANAJEMEN DAN KOMPUTER","http://www.ejournal.stmikdumai.ac.id/index.php/path","S4 Accredited"
"Otopro","https://journal.unesa.ac.id/index.php/jo","S4 Accredited"
"Suluh Pembangunan: Journal of Extension and Development","https://jsp.fp.unila.ac.id/index.php/jsp","S4 Accredited"
"JURNAL TERUNA BHAKTI","http://stakterunabhakti.ac.id/e-journal/index.php/teruna","S4 Accredited"
"Juara: Jurnal Riset Akuntansi","https://e-journal.unmas.ac.id/index.php/juara","S4 Accredited"
"Jurnal Sains dan Seni ITS","http://ejurnal.its.ac.id/index.php/sains_seni","S4 Accredited"
"e-Jurnal Ekonomi Sumberdaya dan Lingkungan","https://online-journal.unja.ac.id/JSEL","S4 Accredited"
"JSM (Jurnal Surya Medika)","http://journal.umpr.ac.id/index.php/jsm","S4 Accredited"
"Dusturiah : Jurnal Hukum Islam, Perundang-undangan dan Pranata Sosial","https://jurnal.ar-raniry.ac.id/index.php/dustur","S4 Accredited"
"Stilistika: Jurnal Pendidikan Bahasa dan Sastra","http://journal.um-surabaya.ac.id/index.php/Stilistika/issue/archive","S4 Accredited"
"Jurnal Ilmiah Bahasa dan Sastra","http://ejournal.unikama.ac.id/index.php/JIBS/issue/archive","S4 Accredited"
"Wardah","http://jurnal.radenfatah.ac.id/index.php/warda","S4 Accredited"
"Healthy-Mu Journal","https://journal.mbunivpress.or.id/index.php/healthy","S4 Accredited"
"Bima Nursing Journal","http://jkp.poltekkes-mataram.ac.id/index.php/bnj","S4 Accredited"
"JAMBURA JOURNAL OF PROBABILITY AND STATISTICS","http://ejurnal.ung.ac.id/index.php/jps","S4 Accredited"
"Santri: Journal of Pesantren and Fiqh Sosial","https://journal.ipmafa.ac.id/index.php/santri","S4 Accredited"
"Journal Midwifery Jurusan Kebidanan Politeknik Kesehatan Gorontalo","http://jurnal.poltekkesgorontalo.ac.id/index.php/JM","S4 Accredited"
"Indonesian Business Review","https://journal.prasetiyamulya.ac.id/journal/index.php/ibr","S4 Accredited"
"Indonesian Journal of International Relations","https://journal.aihii.or.id/index.php/ijir","S4 Accredited"
"Competitor : Jurnal Pendidikan Kepelatihan Olahraga","https://ojs.unm.ac.id/competitor","S4 Accredited"
"Communicare : Journal of Communication Studies","http://journal.lspr.edu/index.php/communicare","S4 Accredited"
"Journal of Integrated System","https://journal.maranatha.edu/index.php/jis/index","S4 Accredited"
"Jurnal Riset Terapan Akuntansi","https://jurnal.polsri.ac.id/index.php/jrtap","S4 Accredited"
"Jurnal Ilmu Ilmu Agribisnis: Journal of Agribusiness Science","http://jurnal.fp.unila.ac.id/index.php/JIA","S4 Accredited"
"Jurnal Ilmiah Farmasi Farmasyifa","https://ejournal.unisba.ac.id/index.php/Farmasyifa/index","S4 Accredited"
"ILKOMNIKA: Journal of Computer Science and Applied Informatics","http://journal.unublitar.ac.id/ilkomnika/index.php/ilkomnika","S4 Accredited"
"Jurnal Keperawatan Widya Gantari Indonesia","https://ejournal.upnvj.ac.id/index.php/Gantari","S4 Accredited"
"Social, Humanities, and Educational Studies (SHEs): Conference Series","https://jurnal.uns.ac.id/SHES","S4 Accredited"
"Jurnal Kesehatan Indonesia (The Indonesian Journal of Health)","https://journal.stikeshb.ac.id/index.php/jurkessia/index","S4 Accredited"
"IJTIHAD","https://ejournal.unida.gontor.ac.id/index.php/ijtihad","S4 Accredited"
"Al-Muqayyad","https://ejournal.stai-tbh.ac.id/index.php/al-muqayyad","S4 Accredited"
"EPI International Journal of Engineering","http://cot.unhas.ac.id/journals/index.php/epiije","S4 Accredited"
"Jurnal Keperawatan Raflesia","http://jurnal.poltekkes-kemenkes-bengkulu.ac.id/index.php/jkr","S4 Accredited"
"INDONESIAN JOURNAL OF LEGAL AND FORENSIC SCIENCES","https://ojs.unud.ac.id/index.php/ijlfs","S4 Accredited"
"Preventif: Jurnal Kesehatan Masyarakat","http://jurnal.untad.ac.id/jurnal/index.php/Preventif","S4 Accredited"
"International Islamic Medical Journal","https://journal2.unusa.ac.id/index.php/IIMJ","S4 Accredited"
"Jurnal Riset Akuntansi","https://ojs.unikom.ac.id/index.php/jira/index","S4 Accredited"
"J-DEPACE (Journal of Dedication to Papua Community) Jurnal Pengabdian Masyarakat","http://jurnal.lpmiunvic.ac.id/index.php/jpkm","S4 Accredited"
"Dharmasmrti: Jurnal Ilmu Agama dan Kebudayaan","https://ejournal.unhi.ac.id/index.php/dharmasmrti/issue/view/23","S4 Accredited"
"Jurnal Integrasi Kesehatan & Sains","https://ejournal.unisba.ac.id/index.php/jiks","S4 Accredited"
"Alfuad: Jurnal Sosial Keagamaan","http://ecampus.iainbatusangkar.ac.id/ojs/index.php/alfuad","S4 Accredited"
"JDHT Journal of Dental Hygiene and Therapy","http://ojs.poltekkesjakarta1.ac.id/index.php/JKG","S4 Accredited"
"Jurnal Mu'allim","https://jurnal.yudharta.ac.id/v2/index.php/muallim","S4 Accredited"
"JURNAL EKONOMI AKUNTANSI DAN MANAJEMEN","https://jurnal.unej.ac.id/index.php/JEAM","S4 Accredited"
"Jurnal Delima Harapan","http://jurnal.akbidharapanmulya.com/index.php/delima","S4 Accredited"
"Jurnal Sains dan Teknologi: Jurnal Keilmuan dan Aplikasi Teknologi Industri","http://ojs.sttind.ac.id/sttind_ojs/index.php/Sain/index","S4 Accredited"
"Jurnal PkM (Pengabdian kepada Masyarakat)","https://journal.lppmunindra.ac.id/index.php/pkm","S4 Accredited"
"Jurnal Ilmiah Setrum","http://jurnal.untirta.ac.id/index.php/jis","S4 Accredited"
"Jurnal Sehat Mandiri","http://jurnal.poltekkespadang.ac.id/ojs/index.php/jsm/issue/archive","S4 Accredited"
"JURNAL SWARNABHUMI","https://jurnal.univpgri-palembang.ac.id/index.php/swarna","S4 Accredited"
"Jurnal Komunikatio","https://ojs.unida.ac.id/index.php/JK","S4 Accredited"
"Academic Journal of Dawa and Communication","https://ejournal.uinsaid.ac.id/index.php/ajdc/","S4 Accredited"
"Jurnal Ilmiah Keperawatan (Scientific Journal Of Nursing)","https://journal.stikespemkabjombang.ac.id/index.php/jikep","S4 Accredited"
"Jurnal Ilmu Komunikasi UHO : Jurnal Penelitian Kajian Ilmu Komunikasi dan Informasi","http://jurnalilmukomunikasi.uho.ac.id/index.php/journal","S4 Accredited"
"Jurnal Teknologi Pendidikan","http://ejournal.uika-bogor.ac.id/index.php/TEK","S4 Accredited"
"IJEBD (International Journal Of Entrepreneurship And Business Development)","https://jurnal.narotama.ac.id/index.php/ijebd","S4 Accredited"
"Jurnal Ilmiah Mimbar Demokrasi","http://journal.unj.ac.id/unj/index.php/jmb","S4 Accredited"
"Jurnal Ilmu-Ilmu Perikanan dan Budidaya Perairan","https://jurnal.univpgri-palembang.ac.id/index.php/ikan","S4 Accredited"
"Journal of Information System,Graphics, Hospitality and Technology","https://jurnal.stts.edu/index.php/insight","S4 Accredited"
"Jurnal Pendidikan Teknologi Kejuruan","http://jptk.ppj.unp.ac.id/index.php/jptk","S4 Accredited"
"Journal Industrial Servicess","http://jurnal.untirta.ac.id/index.php/jiss","S4 Accredited"
"Jurnal Sisfotek Global","https://journal.global.ac.id/index.php/sisfotek","S4 Accredited"
"JRFES (Jurnal Riset Fisika Edukasi dan Sains)","http://ejournal.stkip-pgri-sumbar.ac.id/index.php/JRFES/issue/archive","S4 Accredited"
"JURNAL PENA SAINS","http://journal.trunojoyo.ac.id/penasains/index","S4 Accredited"
"Titian Ilmu: Jurnal Ilmiah Multi Sciences","http://journal.stkipnurulhuda.ac.id/index.php/JTI","S4 Accredited"
"Jurnal Ilmu Administrasi Negara ASIAN (Asosiasi Ilmuwan Administrasi Negara)","https://jurnal.asian.or.id/index.php/JIANA","S4 Accredited"
"Jurnal Integrasi","http://jurnal.polibatam.ac.id/index.php/JI","S4 Accredited"
"SEIKO : Journal of Management & Business","https://journal.stieamkop.ac.id/index.php/seiko/issue/archive","S4 Accredited"
"COMPTON: JURNAL ILMIAH PENDIDIKAN FISIKA","http://jurhttp://jurnal.ustjogja.ac.id/index.php/COMPTON/index","S4 Accredited"
"Jurnal Kedokteran dan Kesehatan : Publikasi Ilmiah Fakultas Kedokteran Universitas Sriwijaya","https://ejournal.unsri.ac.id/index.php/jkk/index","S4 Accredited"
"BINAMULIA HUKUM","http://fh-unkris.com/journal/index.php/binamulia","S4 Accredited"
"EL-Ghiroh","https://jurnal.staibsllg.ac.id/index.php/el-ghiroh","S4 Accredited"
"Geo Media: Majalah Ilmiah dan Informasi Kegeografian","https://journal.uny.ac.id/index.php/geomedia","S4 Accredited"
"IZUMI","https://ejournal.undip.ac.id/index.php/izumi","S4 Accredited"
"Equilibrium Journal of Chemical Engineering","https://jurnal.uns.ac.id/equilibrium","S4 Accredited"
"JUKESHUM: Jurnal Pengabdian Masyarakat","https://ojs.unhaj.ac.id/index.php/jukeshum","S4 Accredited"
"Cepalo","http://cepalo.fh.unila.ac.id/index.php/ojs","S4 Accredited"
"AKURASI: Jurnal Riset Akuntansi dan Keuangan","https://ejournal.imperiuminstitute.org/index.php/AKURASI","S4 Accredited"
"JAS (Jurnal Agri Sains)","http://ojs.umb-bungo.ac.id/index.php/JAS","S4 Accredited"
"Jurnal Perkeretaapian Indonesia (Indonesian Railway Journal)","https://jurnal.api.ac.id/index.php/jpi","S4 Accredited"
"IJPD (International Journal Of Public Devotion)","https://journal.stkipsingkawang.ac.id/index.php/IJPD","S4 Accredited"
"Amanna Gappa","http://journal.unhas.ac.id/index.php/agjl","S4 Accredited"
"JITSI : Jurnal Ilmiah Teknologi Sistem Informasi","https://jurnal-itsi.org/index.php/jitsi","S4 Accredited"
"Jurnal Pengelolaan Lingkungan Berkelanjutan (Journal of Environmental Sustainability Management)","http://www.bkpsl.org/ojswp/index.php/jplb","S4 Accredited"
"Journal of Engineering and Scientific Research (JESR)","http://jesr.eng.unila.ac.id/index.php/ojs","S4 Accredited"
"Journal of Islamic Education Research","https://jier.iain-jember.ac.id/","S4 Accredited"
"MEJ (Mathematics Education Journal)","http://ejournal.umm.ac.id/index.php/MEJ/index","S4 Accredited"
"Journal of Education and Learning Mathematics Research (JELMaR)","http://jelmar.wisnuwardhana.ac.id/index.php/jelmar","S4 Accredited"
"Daun: Jurnal Ilmiah Pertanian dan Kehutanan","http://journal.umpalangkaraya.ac.id/index.php/daun","S4 Accredited"
"AgriPeat","http://e-journal.upr.ac.id/index.php/AGP","S4 Accredited"
"Eduvelop: Journal of English Education and Development","http://ojs.unsulbar.ac.id/index.php/eduvelop","S4 Accredited"
"Jurnal Administrasi dan Manajemen","http://ejournal.urindo.ac.id/index.php/administrasimanajemen","S4 Accredited"
"Jurnal Ekonomi Manajemen","http://jurnal.unsil.ac.id/index.php/jem/index","S4 Accredited"
"Indonesian Journal of Business Intelligence (IJUBI)","https://ejournal.almaata.ac.id/index.php/IJUBI","S4 Accredited"
"Innovatio : Journal for Religious Innovations Studies","http://www.innovatio.pasca.uinjambi.ac.id/index.php/INNOVATIO","S4 Accredited"
"Atfaluna: Journal of Islamic Early Childhood Education","http://journal.iainlangsa.ac.id/index.php/atfaluna/issue/archive","S4 Accredited"
"Jurnal Keperawatan","https://digilib.stikesicme-jbg.ac.id/ojs/index.php/jip","S4 Accredited"
"ELT Echo : The Journal of English Language Teaching in Foreign Language Context.","http://www.syekhnurjati.ac.id/jurnal/index.php/eltecho","S4 Accredited"
"Administratio : Jurnal Ilmiah Administrasi Publik dan Pembangunan","http://jurnaladministratio.fisip.unila.ac.id/index.php/administratio","S4 Accredited"
"Jurnal Teknologi Agro-Industri","http://jtai.politala.ac.id/index.php/JTAI","S4 Accredited"
"Jurnal Pendidikan Teknologi Informasi (JUKANTI)","https://ojs.cbn.ac.id/index.php/jukanti","S4 Accredited"
"Sriwijaya Journal of Environment","http://ojs.pps.unsri.ac.id/index.php/ppsunsri/issue/archive","S4 Accredited"
"Jurnal InterAct","http://ojs.atmajaya.ac.id/index.php/fiabikom/index","S4 Accredited"
"Cyberspace: Jurnal Pendidikan Teknologi Informasi","http://jurnal.ar-raniry.ac.id/index.php/cyberspace/index","S4 Accredited"
"JSES : Journal of Sport and Exercise Science","https://journal.unesa.ac.id/index.php/jses","S4 Accredited"
"Al-Insyirah Midwifery : Jurnal Ilmu Kebidanan (Journal of Midwifery Sciences)","https://jurnal.stikes-alinsyirah.ac.id/index.php/kebidanan/index","S4 Accredited"
"Journal of Early Childhood Education (JECE)","http://journal.uinjkt.ac.id/index.php/jece","S4 Accredited"
"SeBaSa: Jurnal Pendidikan Bahasa dan Sastra Indonesia","http://e-journal.hamzanwadi.ac.id/index.php/sbs/","S4 Accredited"
"Berkala Sainstek","http://jurnal.unej.ac.id/index.php/BST","S4 Accredited"
"SCHOOL EDUCATION JOURNAL PGSD FIP UNIMED","http://jurnal.unimed.ac.id/2012/index.php/school/","S4 Accredited"
"Reswara: Jurnal Pengabdian Kepada Masyarakat","http://jurnal.dharmawangsa.ac.id/index.php/reswara","S4 Accredited"
"Jurnal Edik Informatika","ejournal.stkip-pgri-sumbar.ac.id/index.php/eDikInformatika/index","S4 Accredited"
"IJCIT (Indonesian Journal on Computer and Information Technology)","https://ejournal.bsi.ac.id/ejurnal/index.php/ijcit","S4 Accredited"
"English Education: Journal of English Teaching and Research","https://ojs.unpkediri.ac.id/index.php/inggris","S4 Accredited"
"Grenek: Jurnal Seni Musik","http://jurnal.unimed.ac.id/2012/index.php/grenek/issue/archive","S4 Accredited"
"Jurnal IPTEKS Pemanfaatan Sumberdaya Perikanan","http://journal.unhas.ac.id/index.php/iptekspsp/index","S4 Accredited"
"Media Pendidikan Matematika","http://ojs.ikipmataram.ac.id/index.php/jmpm/index","S4 Accredited"
"ARMATUR : Artikel Teknik Mesin dan Manufaktur","https://scholar.ummetro.ac.id/index.php/armatur","S4 Accredited"
"Diglosia","https://jurnal.unma.ac.id/index.php/dl","S4 Accredited"
"JOURNEY : Journal of English Language and Pedagogy","http://ejurnal.budiutomomalang.ac.id/index.php/journey","S4 Accredited"
"Tunas: Jurnal Pendidikan Guru Sekolah Dasar","http://journal.umpr.ac.id/index.php/tunas/issue/archive","S4 Accredited"
"QARDHUL HASAN: MEDIA PENGABDIAN KEPADA MASYARAKAT","https://ojs.unida.ac.id/index.php/QH","S4 Accredited"
"Jurnal Teknologi Komputer dan Sistem Informasi","http://ojs.stmikpringsewu.ac.id/index.php/jtksi","S4 Accredited"
"Jurnal Infomedia : Teknik Informatika, Multimedia, dan Jaringan","http://ejurnal.pnl.ac.id/index.php/infomedia/index","S4 Accredited"
"IJIS (Indonesian Journal on Information System)","http://ijiswiratama.org/index.php/home/index","S4 Accredited"
"JISA (Jurnal Informatika dan Sains)","http://trilogi.ac.id/journal/ks/index.php/JISA","S4 Accredited"
"Jurnal Kreativitas PKM","http://ejurnalmalahayati.ac.id/index.php/kreativitas","S4 Accredited"
"Jurnal al-Ulum : Jurnal Pemikiran dan penelitian ke-Islaman","http://journal.uim.ac.id/index.php/alulum","S4 Accredited"
"International Journal of Applied Technology Research","https://ijatr.polban.ac.id/ijatr/","S4 Accredited"
"Jurnal Perspektif Pendidikan dan Keguruan","http://jurnal.uir.ac.id/index.php/PSF/index","S4 Accredited"
"JPPM (Jurnal Pengabdian dan Pemberdayaan Masyarakat)","https://jurnalnasional.ump.ac.id/index.php/JPPM","S4 Accredited"
"Rekayasa Bahan Alam dan Energi Berkelanjutan","http://rbaet.ub.ac.id/index.php/rbaet","S4 Accredited"
"JURNAL MANAJEMEN AGRIBISNIS","https://ojs.unud.ac.id/index.php/agribisnis","S4 Accredited"
"JURNAL PEMERINTAHAN DAN POLITIK","http://ejournal.uigm.ac.id/index.php/EGMK/index","S4 Accredited"
"Jurnal Riset Pendidikan dan Inovasi Pembelajaran Matematika (JRPIPM)","https://journal.unesa.ac.id/index.php/jrpipm/","S4 Accredited"
"Jambi Medical Journal","https://online-journal.unja.ac.id/index.php/kedokteran","S4 Accredited"
"FORTE JOURNAL","https://ojs.unhaj.ac.id/index.php/fj","S4 Accredited"
"Eksis: Jurnal Riset Ekonomi dan Bisnis","http://ejournal.stiedewantara.ac.id/index.php/001","S4 Accredited"
"Bioscience","http://ejournal.unp.ac.id/index.php/bioscience","S4 Accredited"
"Legal Standing : Jurnal Ilmu Hukum","http://journal.umpo.ac.id/index.php/LS/index","S4 Accredited"
"Sainteks","http://jurnalnasional.ump.ac.id/index.php/sainteks","S4 Accredited"
"JELLT (Journal of English Language and Language Teaching)","https://jurnal.ustjogja.ac.id/index.php/JELLT/index","S4 Accredited"
"Globish: An English-Indonesian Journal for English, Education, and Culture","http://jurnal.umt.ac.id/index.php/globish/index","S4 Accredited"
"Performa: Media Ilmiah Teknik Industri","https://jurnal.uns.ac.id/performa","S4 Accredited"
"Jurnal Akuntansi","http://ejournal.atmajaya.ac.id/index.php/JARA","S4 Accredited"
"Majalah Ilmiah Bijak","#!","S4 Accredited"
"J SIG (Jurnal Sains Informasi Geografi)","http://journal.umgo.ac.id/index.php","S4 Accredited"
"Medicra (Journal of Medical Laboratory Science/Technology)","https://medicra.umsida.ac.id/index.php/medicra","S4 Accredited"
"Edu-Ling: Journal of English Education and Linguistics","https://journals.unihaz.ac.id/index.php/edu-ling/","S4 Accredited"
"Buletin Profesi Insinyur","http://buletinppi.ulm.ac.id/index.php/bpi","S4 Accredited"
"Jurnal Hukum Mimbar Justitia","https://jurnal.unsur.ac.id/jmj//index.php/jmj","S4 Accredited"
"MAGNA MEDICA: Berkala Ilmiah Kedokteran dan Kesehatan","https://jurnal.unimus.ac.id/index.php/APKKM","S4 Accredited"
"The Journal of Hospital Accreditation","http://jha.mutupelayanankesehatan.net/index.php/JHA","S4 Accredited"
"Journal of Contemporary Indonesian Art","http://journal.isi.ac.id/index.php/jcia","S4 Accredited"
"Journal of Tropical AgriFood","http://e-journals.unmul.ac.id/index.php/JTAF/","S4 Accredited"
"Jurnal Bedah Hukum","https://ejournal.uby.ac.id/index.php/jbh","S4 Accredited"
"Saintara : Jurnal Ilmiah Ilmu-Ilmu Maritim","https://openjurnalsystem.amn.ac.id/index.php/saintara","S4 Accredited"
"Viabel : Jurnal Ilmiah Ilmu-Ilmu Pertanian","https://ejournal.unisbablitar.ac.id/index.php/viabel","S4 Accredited"
"Jurnal Elektronika Otomasi Industri","http://elkolind.polinema.ac.id/index.php/elkolind","S4 Accredited"
"Jurnal Administrasi dan Kesekretarisan","http://jurnal.stiks-tarakanita.ac.id/index.php/JAK","S4 Accredited"
"AKM: Aksi Kepada Masyarakat","https://ejournal.stebisigm.ac.id/index.php/AKM","S4 Accredited"
"Jurnal Riset Kesehatan Poltekkes Depkes Bandung","https://juriskes.com/index.php/jrk","S4 Accredited"
"Lumbung Inovasi: Journal of Community Service","https://journal-center.litpam.com/index.php/linov","S4 Accredited"
"Jurnal Istiqro","http://ejournal.iaida.ac.id/index.php/Istiqro","S4 Accredited"
"Gorontalo Journal of Forestry Research","http://jurnal.unigo.ac.id/index.php/gjfr","S4 Accredited"
"Jurnal Abdimas Bina Bangsa","http://jabb.lppmbinabangsa.id/index.php/jabb","S4 Accredited"
"Jambura Agribusiness Journal","http://ejurnal.ung.ac.id/index.php/jaj","S4 Accredited"
"Jurnal Syarikah : Jurnal Ekonomi Islam","http://ojs.unida.ac.id/index.php/JSEI","S4 Accredited"
"Media Publikasi Promosi Kesehatan Indonesia (MPPKI)","https://jurnal.unismuhpalu.ac.id/index.php/MPPKI","S4 Accredited"
"Sustainable: Jurnal Kajian Mutu Pendidikan","https://jurnal.lp2msasbabel.ac.id/index.php/sus","S4 Accredited"
"Journal of Forest Science Avicennia","http://ejournal.umm.ac.id/index.php/avicennia","S4 Accredited"
"Mediagro","https://publikasiilmiah.unwahas.ac.id/index.php/mediagro","S4 Accredited"
"SYAMIL: Jurnal Pendidikan Agama Islam (Journal of Islamic Education)","https://journal.iain-samarinda.ac.id/index.php/syamil/issue/archive","S4 Accredited"
"Jurnal Aplikasi IPTEK Indonesia","http://bk.ppj.unp.ac.id/index.php/aiptekin/index","S4 Accredited"
"Wahana Sekolah Dasar","http://journal2.um.ac.id/index.php/wsd","S4 Accredited"
"Jurnal HPJI","http://journal.unpar.ac.id/index.php/HPJI","S4 Accredited"
"Jurnal Epsilon","http://ppjp.ulm.ac.id/journals/index.php/epsilon","S4 Accredited"
"Jurnal Pendidikan Matematika","http://ojs.uho.ac.id/index.php/JPM/issue/archive","S4 Accredited"
"JUDIKA (JURNAL PENDIDIKAN UNSIKA)","http://journal.unsika.ac.id/index.php/judika/","S4 Accredited"
"Akuatikisle: Jurnal Akuakultur, Pesisir dan Pulau-Pulau Kecil","https://ejournal.stipwunaraha.ac.id/index.php/ISLE","S4 Accredited"
"UNDAS Jurnal Hasil Penelitian Bahasa dan Sastra","https://ojs.badanbahasa.kemdikbud.go.id/jurnal/index.php/undas/index","S4 Accredited"
"Jurnal Analis Kesehatan","http://ejurnal.poltekkes-tjk.ac.id/index.php/JANALISKES","S4 Accredited"
"Jurnal Ilmiah Syi'ar","https://ejournal.iainbengkulu.ac.id/index.php/syiar/index","S4 Accredited"
"Kajian Bisnis STIE Widya Wiwaha","http://jurnal.stieww.ac.id/index.php/jkb/index","S4 Accredited"
"Assets : Jurnal Ilmiah Ilmu Akuntansi, Keuangan dan Pajak","https://ejournal.itbwigalumajang.ac.id/index.php/asset","S4 Accredited"
"PROCESSOR Jurnal Ilmiah Sistem Informasi, Teknologi Informasi dan Sistem Komputer","https://ejournal.unama.ac.id/index.php/processor","S4 Accredited"
"Jurnal Ilmiah RESPATI","http://ejournal.urindo.ac.id/index.php/pertanian","S4 Accredited"
"Jurnal Tarbiyah: Jurnal Ilmiah Kependidikan","http://jurnal.uin-antasari.ac.id/index.php/jtjik/index","S4 Accredited"
"Jurnal Agronomi Tanaman Tropika (JUATIKA)","http://ejournal.uniks.ac.id/index.php/JUATIKA","S4 Accredited"
"EduBasic Journal: Jurnal Pendidikan Dasar","https://ejournal.upi.edu/index.php/edubasic","S4 Accredited"
"Assets : Jurnal Ekonomi, Manajemen dan Akuntansi","http://journal.uin-alauddin.ac.id/index.php/assets","S4 Accredited"
"Jurnal Otomasi, Kontrol, dan Instrumentasi","http://journals.itb.ac.id/index.php/joki/issue/archive","S4 Accredited"
"Akuatiklestari","https://ojs.umrah.ac.id/index.php/akuatiklestari/index","S4 Accredited"
"An-Nisa': Jurnal Kajian Perempuan dan Keislaman","http://annisa.iain-jember.ac.id//index.php/annisa","S4 Accredited"
"Majalah Kesehatan Indonesia","https://ukinstitute.org/journals/1/makein","S4 Accredited"
"GOVERNABILITAS (Jurnal Ilmu Pemerintahan Semesta)","http://jurnal.apmd.ac.id/index.php/governabilitas","S4 Accredited"
"Journal of Applied Veterinary Science and Technology","https://e-journal.unair.ac.id/javest","S4 Accredited"
"Journal of Energy, Material, and Instrumentation Technology","http://jemit.fmipa.unila.ac.id/index.php/jurnal","S4 Accredited"
"Wajah Hukum","http://wajahhukum.unbari.ac.id/index.php/wjhkm","S4 Accredited"
"Jurnal Teknologi Informasi & Komunikasi dalam Pendidikan","http://jurnal.unimed.ac.id/2012/index.php/teknologi","S4 Accredited"
"Jurnal Media Pertanian","http://jagro.unbari.ac.id/index.php/agro","S4 Accredited"
"Jurnal Pertanian","http://ojs.unida.ac.id/index.php/jp/","S4 Accredited"
"Dinamik","https://www.unisbank.ac.id/ojs/index.php/fti1","S4 Accredited"
"Management Studies and Entrepreneurship Journal (MSEJ)","https://journal.yrpipku.com/index.php/msej","S4 Accredited"
"JURNAL KEBIDANAN","https://akbid-dharmahusada-kediri.e-journal.id/JKDH/issue/archive","S4 Accredited"
"Jurnal Notariil","https://ejournal.warmadewa.ac.id/index.php/notariil/index","S4 Accredited"
"Sketsa Bisnis","https://www.jurnal.yudharta.ac.id/v2/index.php/SKETSABISNIS","S4 Accredited"
"CYCLOTRON : JURNAL TEKNIK ELEKTRO","http://journal.um-surabaya.ac.id/index.php/cyclotron/issue/archive","S4 Accredited"
"Jurnal Agribisnis dan Agrowisata (Journal of Agribusiness and Agritourism)","https://ojs.unud.ac.id/index.php/JAA","S4 Accredited"
"MEC-J (Management and Economics Journal)","http://ejournal.uin-malang.ac.id/index.php/mec","S4 Accredited"
"Akbis: Media Riset Akuntansi dan Bisnis","http://jurnal.utu.ac.id/jakbis/index","S4 Accredited"
"Jurnal ICMES: The Journal of Middle East Studies","https://ic-mes.org/jurnal/index.php/jurnalICMES/","S4 Accredited"
"AJAR : Atma Jaya Accounting Research","http://ojs.feb.uajm.ac.id/index.php/AJAR","S4 Accredited"
"Bidayah: Studi Ilmu-Ilmu Keislaman","https://ejournal.staindirundeng.ac.id/index.php/bidayah","S4 Accredited"
"DISTILAT: JURNAL TEKNOLOGI SEPARASI","http://distilat.polinema.ac.id/index.php/distilat","S4 Accredited"
"Jurnal Pemikiran dan Penelitian Psikologi Insight","http://jurnal.unmuhjember.ac.id/index.php/INSIGHT","S4 Accredited"
"Manuju : Malahayati Nursing Journal","http://ejurnalmalahayati.ac.id/index.php/manuju/issue/archive","S4 Accredited"
"INTEGRITAS : Jurnal Pengabdian","https://unars.ac.id/ojs/index.php/integritas/about","S4 Accredited"
"Lisan Al-Hal : Jurnal Pengembangan Pemikiran dan Kebudayaan","https://journal.ibrahimy.ac.id/index.php/lisanalhal/index","S4 Accredited"
"Jurnal Abdi Insani Universitas Mataram","http://abdiinsani.unram.ac.id/index.php/jurnal","S4 Accredited"
"NUR EL-ISLAM : Jurnal Pendidikan dan Sosial Keagamaan","http://ejournal.staiyasnibungo.ac.id/index.php/nurelislam/index","S4 Accredited"
"Healthy Tadulako Journal (Jurnal Kesehatan Tadulako)","https://jurnal.fk.untad.ac.id/index.php/htj/index","S4 Accredited"
"INFOKUM","http://infor.seaninstitute.org/index.php/infokum","S4 Accredited"
"Jukung (Jurnal Teknik Lingkungan)","https://ppjp.ulm.ac.id/journal/index.php/jukung","S4 Accredited"
"E-Prodenta Journal of Dentistry","https://eprodenta.ub.ac.id/index.php/eprodenta","S4 Accredited"
"Shautut Tarbiyah","http://ejournal.iainkendari.ac.id/shautut-tarbiyah/index","S4 Accredited"
"Jurnal SMART Kebidanan","http://stikesyahoedsmg.ac.id/ojs/index.php/sjkb","S4 Accredited"
"PRASI: Jurnal Bahasa, Seni, dan Pengajarannya","https://ejournal.undiksha.ac.id/index.php/PRASI","S4 Accredited"
"JURNAL ILMU EKONOMI & SOSIAL","http://ejournal.unmus.ac.id/index.php/ekosos","S4 Accredited"
"JURNAL BAHASA, SASTRA, DAN PEMBELAJARANNYA (JBSP)","https://ppjp.ulm.ac.id/journal/index.php/jbsp/issue/archive","S4 Accredited"
"Jurnal Mutu Pangan : Indonesian Journal of Food Quality","https://journal.ipb.ac.id/index.php/jmpi","S4 Accredited"
"Jurnal Redoks","https://jurnal.univpgri-palembang.ac.id/index.php/redoks","S4 Accredited"
"Buletin Ilmiah Sarjana Teknik Elektro","http://journal2.uad.ac.id/index.php/biste","S4 Accredited"
"Jurnal Ilmiah Matematika dan Pendidikan Matematika (JMP)","http://jos.unsoed.ac.id/index.php/jmp","S4 Accredited"
"Natural Science: Jurnal Penelitian Bidang IPA dan Pendidikan IPA","https://ejournal.uinib.ac.id/jurnal/index.php/naturalscience","S4 Accredited"
"ZONAsi : Jurnal Sistem Informasi","https://journal.unilak.ac.id/index.php/zn/","S4 Accredited"
"agroscience","https://jurnal.unsur.ac.id/agroscience/index","S4 Accredited"
